level,source,reply,post,language,language_variety,reply_id,post_id,majority_vote
2.0,twitter,@USER Andata con le migliori intenzioni. Compendio senza amore e senza contenuto della sua produzione. Ennesimo occhio strizzato al selfie. Speravo in qualcosa di più per un artista così sensibile. Mostra fagocitata dal bisogno di esprimersi con termini più estetici che contenutistici.,"@USER Interessante. In passato mi sono piaciute alcune opere di Eliasson, cos'ha questa mostra che nn va? In generale cmq sono d'accordo con te.",it,it,16499725093438283035,4182713032123149285,0
1.0,twitter,@USER Si e per diventare santa subito,"#donnalisi allora mi sorge un dubbio se Micol non è andata al GF per le telecamere,è andata per riconquistare  Edo D e rompere le palle ad Antonella?",it,it,6122081151389576797,8553934668525359548,1
1.0,reddit,Interessantissimo! Comunque io mi riferivo più a catene di negozi che fanno questo (in America ne son pieni da quanto ho visto). Comunque sono in zona di Salerno :),"Io compro usato da anni ormai, e nella mia esperienza in ogni città, sia in Olanda (che però non è quello che mi stai chiedendo) sia in Italia (città più o meno grandi: Padova, Bologna, Napoli, Trieste e Trento, nella mia esperienza, hanno tutte qualche negozio) almeno un negozio di usato lo trovi. Chiaro che una volta lì devi riuscire a riconoscere un minimo un vestito che non vale un cazzo da un vestito fatto bene, che quindi regge sia l'utilizzo che il tempo, però c'è sempre (a meno che tu non vada su grandi marche) un gran risparmio rispetto a comprare un vestito nuovo, e soprattutto è una soluzione eco-friendly. Inoltre alcuni di questi negozi hanno anche fondi di magazzino, quindi non sono vestiti usati ma vestiti vecchi, quindi nemmeno pluriscoreggiati da altri. Secondo me se cerchi con cura qualcosa trovi anche nella tua città (dove vivi?).",it,it,7385918218583749216,9907299402150149948,0
1.0,reddit,"Io lo stavo per fare, menomale che m'ha lasciato dopo 10 anni prima che lasciassi il lavoro e tutto il piccolo mondo che avevo costruito per seguirla.","Qualcuno di voi si è trasferito all'estero per continuare una storia d'amore? 
Se sì, com'è andata?",it,it,16977026197865642982,18191086833362311695,0
1.0,twitter,@USER Non serve a niente,Pausa di riflessione in una relazione sentimentale:,it,it,6839063199766351033,10244167378452133620,0
1.0,reddit,">cioè manco una telefonata al giorno possono fare?
Seriamente? A me darebbe fastidio se mia madre o la madre di mia moglie chiamasse tutti i giorni.","Dai però, i consigli degli altri giustissimi, ma già abitate lontano e ""chiamate quasi giornaliere"" cioè manco una telefonata al giorno possono fare?
Secondo me stai sbagliando approccio, ricordati sempre che le ragazze si possono cambiare, le madri no. E le coppie da mulino bianco non esistono, un giorno, magari fra anni, avrete un periodo di crisi (e l'avrete, tutti ce l'hanno) e sarà meglio non avere la madre contro che ti scava la fossa, o quantomeno non dovrai essere tu a scavarti la fossa da solo mettendo dei paletti stupidi (again, non puoi dirgli come una deficente ""o me o lei"" perché non esiste al mondo).
Poi se non sopporti la sua teatralità ci sta, ma tu stai col figlio, lo ha cresciuto lui, se lui ti piace così è pure merito suo.
I paletti li devi mettere, certo, ma educandoli piano piano, non litigando inutilmente o costringendolo a scelte assurde. Ripeto, siete già all'estero e hai già vinto per il momento, non perdere la calma passando dalla parte del torto facendo la possessiva più della madre.",it,it,13802915445762412958,8277343832048743975,0
1.0,twitter,@USER Buongiorno Marco ?☕️,Buongiorno ☕? buona domenica,it,it,1559713244230604347,10373863363995538997,0
2.0,twitter,@USER  @USER  @USER Dietro liceo davanti museo ???,@USER Altro mitico travestimento di Fantomas @FabioLisci,it,it,13774786005298998319,527554389017052205,1
2.0,twitter,@USER È una pagina satirica,@USER Non ho parole!?,it,it,503393202912719703,13369522766325597733,0
1.0,twitter,Non si non non so,"Non so riesce più ad interagire cmq,qui ed è anche per quello che ci sto di meno,a parte il poco tempo che ho...io se dico un mio pensiero diverso da quello di un altro, quest'altro deve dirmi altre cose ancora e polemizzare e nel frattempo mi girano solo le palle perché ho espre",it,it,8600755212808133083,3334992746003161797,0
1.0,reddit,"Io mi sto informando tantissimo, e sono disoccupato a causa del virus (avrei dovuto firmare lunedì scorso a Milano ed é rinviato a data da destinarsi causa psicosi).
No mascherine no amuchina no spesa speciale (solo un po'più di acqua).
Ma sono comunque preoccupato. Più che per la malattia in sé per le conseguenze sanitarie di ospedali intasati (x i miei parenti) e per gli effetti economici/lavorativi","Ma qualcuno di immune dalla psicosi da coronavirus?
Sono l'unica che non ha comprato scorte per 2 anni, no mascherine, no amuchina e una grande indifferenza?
Cioè uso i mezzi come prima, mi lavo le mani quanto prima etc
Qualcuno sa se riaprono ste benedette palestre? Eddai Milano!",it,it,6992322014432255856,4623630872912708152,0
1.0,twitter,"@USER Se la giocano bene entrambi, ma MR ha ancora un buon margine su CC, non arma dei carabinieri",Calenda fa quasi piú schifo di Renzi.,it,it,12933982629839826110,14790204455694452104,0
1.0,reddit,"probabilmente non dormi a sufficienza nelle tue giornate. Se magari hai la sveglia presto, non arrivi non dico a 8 ma neanche a 7 ore, e' normale che poi ti venga sonno.
magari potrebbe anche essere, chi puo' dirlo, che scegli sempre film di merda e noiosissimi :)","Saranno i trenta alle porte ma da qualche anno ho un problema che mi affligge, se guardo un film a casa finisce sempre che mi addormento.
Sembra una cosa da poco ma non riesco più a vedere un film per intero, nemmeno in compagnia di qualcuno e poco importa se si tratta di un horror, di un cinepanettone o del titolo che sognavo di vedere da anni, dopo poco collasso.
L'unica soluzione per ora è guardare il film seduto al pc o tenermi attivo durante la visione, è come se non fossi più compatibile con l'intrattenimento passivo e la mia soglia d'attenzione si sia ridotta al minimo.
Succede anche a voi?",it,it,6656710646366050167,13443248073914882430,0
2.0,twitter,"@USER Ciao carissima Beatriz, ti ringrazio e buon proseguimento di giornata ?☕?",@USER Buongiorno Cristina bella domenica ?,it,it,2317243296015884541,8747552104047718281,0
1.0,reddit,">  niente nudi, niente sesso
Nuuuu :( ma l'erotismo è una parte vitale di AC, come si fa a toglierlo","DELUSIONI SERIE TV 2020:
Altered Carbon di Netflix: hanno cambiato attore, letteralmente inguardabile, e poi niente nudi, niente sesso, storia scritta malissimo ecc.. sembra passato da HBO a CW o Starz, Bastava copiare la 1 e sarebbe stata grandiosa.
Star Trek Picard: storia super lenta fino al 6 episodio, ne rimangono 5 LOL e comunque sia è una palla noiosa dove non accade un cazzo e l'attore è vecchio, è ora di passare la torcia a qualcun'altro.
Sabrina serie 3 Netflix: scandalosa, hanno buttato via tutto quello che hanno fatto, è diventata la brutta copia di Riverdale o peggio(scrittura imbarazzante). anche qui, bastava copiare dalle precedenti.
Narcos Messico 2: a parte qualche episodio tutto il resto è da buttare, la scrittura fa sembrare l'attore principale un coglione alla mercè degli altri quando non era così e poi ci sono troppe storie che non c'entrano un cazzo e servono solo ad allungare il brodo.anche qui, bastava copiare dalle precedenti.",it,it,1607585294217794980,16308825415495635533,0
1.0,reddit,"Ieri il corriere DHL passa per la seconda volta a casa, c'era qualcuno e ovviamente non ha suonato, lasciando nuovamente il biglietto per mancata consegnata.","Ringrazio sentitamente il corriere DHL che per ben due giorni di fila invece di chiamarmi affinché aprissi la sbarra che da accesso alla via dove ho la residenza decide di mettere semplicemente la spunta ""indirizzo errato"".
E dire che il mio numero ce l'hanno (visto che mi arrivano le notifiche) e avrebbe perso al più 10 secondi fermo. 
Ringrazio anche l'operatore del call center chiamato il secondo giorno per avermi detto che ""la chiamata non è garantita"" mentre l'operatore del primo giorno mi aveva detto che avrebbe certamente chiamato.
Dovete iniziare a lavorare seriamente. Mi sono rotto il cazzo di chi fa le cose con sufficienza pretendendo di essere pagato bene.",it,it,10069545862381242208,12669434456077217988,0
2.0,twitter,@USER  @USER  @USER Grazie a te ??,@USER  @USER  @USER GRAZIEEEEE. SEI STATA GENTILISSIMA. UN ABBRACCIONE.,it,it,7593040529154512177,16419620603737519349,0
1.0,reddit,Scusa ho appena avuto una sincope leggendo il tuo post. Dici che è grave? /s,"Ragazzi/e per piacere non venite qui in cerca di diagnosi. Fatevi visitare dal vostro medico curante, chiamate i numeri preposti, ma non affidatevi a dei completi sconosciuti che non hanno i mezzi e/o le competenze per farlo (corona virus a parte, adottatela come regola generale per favore).",it,it,16848487518880439428,15986361946082174146,1
1.0,reddit,Non hai un mc vicino? È più salutare mangiare li tutti giorni.,"francamente la pasta al microonde sono tentato di provarla perché al lavoro ho quello e basta.
Risparmierei soldi rispetto ai piatti precotti da microonde.",it,it,11658098842295024801,16653175777918050962,1
1.0,reddit,Leggevo l'altro giorno un articolo che non riesco più a trovare in cui si diceva che secondo recenti valutazioni non è certo che il virus possa diminuire l'infettivita con il cambio di stagione,Ci sono molte possibilità che il virus sparisca intorno ad aprile con l'arrivo di temperature più alte?,it,it,6955818550798913492,3847723101497637531,0
1.0,reddit,"io sapevo che l'ottimo sarebbe tenerlo sempre al 60%, essendo impossibile si fa tra il 20 e 80.","Sento molte persone che prima di mettere a caricare il telefono aspettano che la batteria si scarichi al 10/20%, forse perché abituate alle vecchie batterie al piombo.
Ma è vero che con le batterie a Litio il problema della memoria non sussiste ma che è anzi meglio caricare il cellulare poco e spesso durante il giorno?
Vi faccio un esempio concreto: da poco mi hanno regalato delle AirPods e sto cercando di trattarle il meglio possibile per fare in modo che la batteria duri. 
C’è molta gente che lascia scaricare la custodia e la carica ogni qualche giorno, ma teoricamente non sarebbe meglio tenerla sempre con più carica possibile? Magari mettendola a caricare ogni sera, come il telefono.
A rigor di logica mi sembra una cosa giusta da fare, ma ci sono dei rischi di cui non sto tenendo conto nel caricarle poco e spesso?",it,it,4973841049901758698,11000134903498080071,0
1.0,reddit,Io sono rimasto a quelli con i Golf 4 grigio perla.,"Quindi senso comune confermato, chi guida Audi e BMW è un coglione.",it,it,4389956713331137748,14672930942777869739,1
2.0,twitter,@USER Capito sì? ???,@USER Una tuttofare ??,it,it,17665996701756597518,7501166755663576500,both
1.0,reddit,È inglese? Sono di base scemi e con il complesso di superiorità.,"Oggi la ritardata della mia collega é riuscita ad essere mega sympa unendo in una sola frase il C. Virus e la mafia per via della mia provenienza sicula. Wow.
such joke
much fun",it,it,12680189878604401746,18298855339031564485,1
1.0,reddit,Direi loro di leggere il vangelo di Luca 13:1-6. Gli è indirizzato.,"Che ne pensate di quegli ultracattolici, convinti che papa Francesco stia distruggendo la chiesa, che si scagliano con la bava alla bocca contro di lui augurandogli di morire a causa del Coronavirus, che ritengono una punizione divina? Come cavolo fanno a definirsi cattolici se augurano la morte a una persona che non gli ha fatto nulla di male? Che fine ha fatto il voler bene al prossimo?",it,it,12210448347044972665,16565537520034275224,1
1.0,twitter,@USER Dipende dalle circostanze... non condanno e non approvo.,"Eri bono ma dopo il primo incontro, mi ha detto subito:""Tu sei mia!""

Tratto da una storia vera.

#eribonoma",it,it,5289256277775686267,7571910693681746271,0
1.0,reddit,"Chiunque con un fetish piuttosto specifico la cui fonte sono principalmente video amatoriali si rende subito conto che quel genere di video tende a rimanere online per poco tempo. Quando si trova un bel video amatoriale è sempre meglio salvarlo, meglio un giga in meno sul computer che pensare a quel porno così bello che non ritroverai mai più.",Io non ho mai capito perché si dovrebbero salvare i porno. Perché? Per quando non c'è internet?,it,it,16021170317909993863,16167343742615103161,0
2.0,twitter,@USER Ahahahahah d’altronde il nome non mente ??,@USER Lo vedo già capitano ad incitare la sua squadra ??,it,it,10204577474727038300,3936236345669485504,0
1.0,reddit,4000$ avevo letto,"Madre mi ha fatto una domanda strana stamane.
""Quanto costa un tampone per il coronavirus!""
E niente, Google non mi ha dato risposta.
Quanto costa allo stato italiano effettuare 1 singolo tampone e riceverne risposta?",it,it,6295243627667993108,14849029575208684856,1
2.0,twitter,@USER Io mi assicurerei del contrario...?,@USER Qualcuno sa come ci si potrebbe assicurare di questo?... ?,it,it,13932824916509766942,17406266981620550655,both
1.0,reddit,">perché non vogliono pensare a niente
Fidati, fino a 5-6 anni fa ti avrei mandato in culo, ma adesso capisco fin troppo bene cosa voglia dire.
Quelle 2 ore di programma ritardato, che ti fanno andare in standby il cervello a volte sono una manna. Ogni 10/15 minuti check del telefono, magari sorsetto di birra o tisana, poi alle undici e rotti nanna.
Non dico di farne la routine, ma quando ci vuole ci vuole.","C’è chi esce ogni sera, chi gioca alla play e chi si rincoglionisce davanti i programmi trash. Conosco diverse persone che li guardano perché non vogliono pensare a niente e stare sdraiati sul divano a rilassarsi.",it,it,17563455736962909721,10432377660085486211,0
1.0,reddit,"Lebowski? Cioè la porto al bowling, a combattere contro i nichilisti e a distruggersi di White Russian?","organizzati con altri genitori e fate giocare i bambini insieme, poi quando crescono li puoi portare al planetario, li fai giocare al lebowski, li porti a teatro (per bimbi) oppure in giro per le campagne..",it,it,2387683106799630597,10279940017783444627,1
1.0,twitter,@USER se stavo bene mica ero qui,"Ma vii, a livello psichiatrico , come state ?",it,it,8485093943334291855,7926235817378922072,1
1.0,reddit,Se riesci a procurarti una pistola a quell'età non so quanto sia facile tornare sulla retta via dato che devi avere già un network importante per trovare armi di contrabbando.,">Secondo le prime notizie il ragazzo era armato; il militare ha reagito e nella sparatoria il 15enne è rimasto ferito con colpi che lo avrebbero raggiunto al capo e al torace.
Dispiace per la perdita di una vita umana, e perché era un 15enne coglione che magari si sarebbe potuto ravvedere e ""tornare sulla retta via"" ma... Insomma, se fai rapine a mano armata il rischio è questo.",it,it,12685968339337542648,1289207144106026906,0
2.0,twitter,@USER Ti ringrazio,@USER Buongiorno,it,it,17980685203803614513,4343250758748505972,0
2.0,twitter,@USER Si sono convinto pure io . Tutto può accadere,@USER Nella vita tutto può succedere,it,it,7390466605932988746,12748947280804015335,0
1.0,twitter,@USER Attento al femore,"Nel 2023 esce il nuovo film di Indiana Jones sempre interpretato da Harrison Ford: 80 anni! 
Che gli vogliamo dire?",it,it,4603973994291651916,17948825530378828840,1
1.0,reddit,"*Fottuto moralismo in generale
La parte cristianeggiante é soltanto una scusa",Fottuto moralismo cristianeggiante,it,it,10462018945349578152,16379255176565534094,1
2.0,twitter,@USER Diciamo che sono artisti spesso entrati in grandi polemiche,"@USER Invece di scrivere "" c'è da divertirsi"" non era meglio scrivere "" c'è curiosità"" ? Perché così sembra che li volete prendere in giro. Sono due artisti, con qualche piccolo incidente di percorso nella carriera, ma pur sempre due grandi artisti",it,it,6711054919788084210,17787330736597026619,0
1.0,reddit,"Ha più senso il ragionamento che frenare causa un consumo progressivo dei dischi dei freni e delle gomme: il consumo delle gomme genera polveri sottili mentre quello dei dischi comporta una sostituzione proporzionalmente anticipata degli stessi e quindi l'inquinamento dato dalla produzione del pezzo di ricambio.
La scelta ambientalista è frenare il meno possibile.","Auto più costosa = più cavalli = più benzina consumata a far passare i pedoni...
Mi pare ecologicamente giusto non far passare i pedoni se la tua macchina ha più di 200cv...
/s",it,it,12261921827305638030,12802596261741493988,1
1.0,twitter,@USER Quello  per i scarafaggi dovrebbe  andare bene,"La sensibilità che sbandieri #graduidamente su questo social non ti ha suggerito, già che c’eri, di fare un salto a Ischia a parlare con quelli che tu hai trasformato negli ultimi???? #GiuseppeConte sei un’autentica macchietta .. da rimuovere con uno spray.",it,it,8660853111156343949,2306502567302935077,1
1.0,twitter,@USER ??? ce ne fossero!,"“Farò la tessera del PD e rispetterò l’esito delle primarie, qualunque esso sia.

Serve un PD che sia ecologista, progressista e di sinistra.”

#Schlein",it,it,18249641666770138069,14640485105182074817,0
2.0,twitter,@USER  @USER Non l'ho sentito ma per me non è una novità.,@USER Tutto ok. Scossa di terremoto alle 8.12. Ma niente di grave,it,it,1474421710304239825,14349286535344991599,0
1.0,reddit,"Devo fare un rewatch, ho un hype assurdo","Questo mese inizia Westworld stagione 3 yeeee, speriamo sia bella.",it,it,3523481840562100497,7521967141735298063,0
2.0,twitter,"@USER Buongiorno a te ... buona domenica.
..anche se senza liga?",@USER Buen Giornio Giancarlo Carlo!??,it,it,18295973819755092449,6266511079736753847,0
1.0,reddit,"Taglio ai polmoni. Senza polmoni non si può morire di polmonite.
black guy pointing finger at head",Dove tagliereste per fare fronte al coronavirus?,it,it,17770688488279751800,10644245602980409727,1
1.0,twitter,"@USER Quello che dice sangiov. ha senso: se sono persone con cui si può dialogare, fai presente nei dovuti modi, che per te non è + possibile andare avanti cosí e che hai fatto il pox per andare incontro alla situazione ma ora non puoi piu farlo, e vedi che rispondo. Poi deciderai.",Ora vi dirò una cosa un po’ personale. Lavoro da aprile in un ristorante che ha aperto quest’anno. Bene io non vedo lo stipendio da settembre dandomi solo in acconto di 400 € perché non c’è la fanno per via del poco lavoro. Ps: sono l’unico dipendente.,it,it,8673631839745288044,1722448325998141834,0
1.0,twitter,"@USER Si

Il Musk(io) lo hanno già tutto adoperato per il presepe",Alla terza volta che si pianta #Twitter va bene mandare una bestemmia come feedback?,it,it,16813718916983401584,6621863004798281614,1
2.0,twitter,"@USER  @USER  @USER  @USER Concordo, anche quello di  @USER è molto fuori dal suo stile...ero già pronto a leggere un ""Hey"" e invece nemmeno quello","@USER  @USER  @USER Ma non ha niente del mio stile ? Sembra un testo totalmente generico, forse mi sfugge qualcosa",it,it,1477160500535743152,14249436497540944767,0
2.0,twitter,@USER Fra ma ciao ???,@USER Buongiorno Stefi ☕?,it,it,5069105560692779172,12330261586835095548,0
1.0,twitter,@USER Era ora Pierluigi,"COSTITUENTE (?) DEL PD. Un gruppo di nominati, in buona parte neppure elettori, che attraverso la modifica di statuto e carta dei valori vuole far cambiare natura al PD. Ma se cambia natura non è più il Pd. Semplice. 
Fermate la giostra, per favore.",it,it,15135757651282143969,18248931801541490801,0
2.0,twitter,@USER Va bene?,"@USER Fiat 500X da gennaio 2016
Uno spettacolo",it,it,15915657440891980196,6614575529664245778,0
1.0,reddit,Tuo padre è un uomo saggio,"Mio babbo dice sempre: ""trovala orfana""",it,it,9931289976776163029,5977190667122478859,both
1.0,reddit,"I dati giornalieri lasciano sempre il tempo che trovano in realtà.
Bisogna vedere se i numeri restano stabili, calano o riprendono a salire.",">In Italia frenano i contagi: lunedì l'incremento dei malati è stato del 16% (258 casi in più) a fronte dell'aumento del 50% registrato il giorno prima. Di questi, inoltre, il 50% è asintomatico (o con sintemi lievi) e in isolamento domiciliare, il 40% è ricoverato con sintomi e solo il 10% in terapia intensiva. ""Un dato confortante"" dice il commissario Angelo Borrelli sottolineando che si tratta di una percentuale che ricalca il dato complessivo: su 1.835 malati, 927 sono in isolamento nella propria casa, 742 ricoverati con sintomi e 166 in terapia intensiva. Sono 149 i guariti, 52 i decessi.",it,it,17456143121529200704,16302263758898016470,0
1.0,reddit,Fallo tranquillamente.,"Dovevo chiedere un'informazione via whatsapp ad una ragazza, la quale ha pensato che ci stessi provando e mi ha ghostato. 
E' un po' imbarazzante perché mandarle un messaggio ""Guarda che non ci stavo provando"" mi sembra piuttosto rude.",it,it,10551086351398523335,3864415561040203025,0
1.0,reddit,"Un'entrata massiccia di soldi bella Linux Foundation per la creazione di una distro europea(la vedo dura che accettino di usarne una esistente) sarebbe interessante, anche perché non ci sarebbe più una community di appassionati sotto ma sviluppatori ben stipendiati potrebbe dare quel che manca alle altre distro GNU/Linux","Scusate ma Linux che è? È pure nato in Finlandia! Linus Torvalds è finlandese.
E Opera browser è norvegese.",it,it,4281855027659157689,10501778225878119628,0
1.0,reddit,A 3000 punti coronavirus vinci un biglietto gratis per una seduta di pedicure dal cinese.,"Bollettino della Protezione Civile di oggi:  URL 
Si ""festeggiano"" i 2000 contagiati totali ed i 1000 in Lombardia; 52 deceduti; 149 guariti.
742 ricoverati + 166 in terapia intensiva (quindi circa il 45% dei contagiati è ospedalizzato).",it,it,11902735492634000037,9283656897473442907,1
1.0,reddit,"Ha ripreso a postare e commentare su reddit un'ora fa dopo un'assenza di 3 mesi, non fa altro che raccomandare di visitare Istambul...",Ma che è ci hanno invaso i bot russi?,it,it,3080049514596252744,16742840163558516120,0
2.0,twitter,@USER Stranamente c’è ancora ?,@USER Tu si vede la linea dell’abbronzatura. ??,it,it,12758364105608126682,3019465319828424065,0
1.0,reddit,">non è che la logica la scrivi coi si ma però ripeti
Certo che no, come Monicelli insegna si scrive così:
che cos'è il genio?
intuizione:
genio come se fosse genio meno 1
o magari intuizione diviso 2:
genio come se fosse genio più 1
o magari maggiore di mobiletto per due:
genio come se fosse genio per 2
o tarapia tapioco:
genio come se fosse 2
e velocità di esecuzione
&#x200B;
EDIT: e un sincero vaffanzum pure a reddit che non mantiene le indentazioni.","Io non so se sei stato su r/programming o r/learnprogramming ma quando qualcuno fa la domanda ""da dove inizio?"" la risposta è nel 99% dei casi ""dipende da cosa vuoi fare"". Quindi non so che dibattito uno possa aprire, a meno che la tua idea non sia dirci che siamo d'accordo a vicenda.  
Cioè a me dispiace fare il gatekeeper che uccide i gattini ma se uno interessato all'ambito non riesce a fare una ricerca google sull'argomento e arrivare da solo ad una certa conclusione perché non vuole usare risorse in inglese non so cosa dire. Non è che dobbiamo essere tutti bilingue ma cristo santo, non è che la logica la scrivi coi si ma però ripeti.",it,it,2547240166855609734,9213173975180897953,0
1.0,reddit,"Mi sa abbiamo tutti avuto lo stesso trauma sociale, una volta usciti dall'isola :D","Fai così: invita questi tuoi amici e dì loro che offri tu da bere e il dolce ( e magari un giro dopo al bar, non so che serata pensi di fare). 
Digli di non farti il regalo ma che per il resto il conto si divide.
Puoi anche attaccare un pippone che il regalo sia lo stare assieme etc etc
&#x200B;
Digressione: da sardo, il ""chi paga cosa"" è stato uno dei traumi sociali più grossi quando sono andato nel barbaro continente.
Da noi chi invita paga. Punto. Invito 10 persone a prendere la pizza per cena? Pago io il conto. 
Siamo al bar e chiamo io il cameriere? Il giro è mio. Allora il prossimo lo fa un altro. E quello dopo un altro. E credimi, è un ottimo modo per finire con un tasso alcolemico piuttosto alto piuttosto in fretta.
&#x200B;
Arrivato a Pisa cominciai ad essere invitato a compleanni in cui mi pagavo la cena e mettevo la quota del regalo. L'invitato pagava boh, la torta? Serate al bar dove ognuno pagava il suo etc etc.
&#x200B;
Questo per dire che è una cosa culturale e molto locale.",it,it,13445025746676793122,16822415573863280985,both
1.0,reddit,">Burioni
è un tipo che ne capisce","Ma Burioni... Chi è? 
Perché continua a dire o postare cose sul suo blog che fanno preoccupare, al contrario del resto della comunità scientifica che, pur non sottovalutando la cosa, continua a ribadire che la maggior parte della gente guarisce, che quelli con altre patologie/età avanzata sono quelli più a rischio etc.
Quindi mi chiedo: è un frustrato a cui piace fare casino e creare panico, o c'è davvero da allarmarsi più del dovuto?",it,it,15283811421010073467,7693897363049516163,0
1.0,reddit,anche /r/coronavirus è abbastanza informativo.,"r/COVID19 mi sembra abbastanza leggibile e informativo
Ho trovato interessante questo thread sull'utilizzo dello Iodio 
come antisettico. A casa ho un flacone di iodio disinfettante ma non il colluttorio che mai ho considerato. Stasera farò  un salto in farmacia.
edit: edit",it,it,7239601337413149797,2467639486973714070,0
1.0,reddit,un cliente ha recuperato non so come il mio numero personale. Richiedo soccorso immediato.,sono ancora in call ragazzi send eutanasia,it,it,12362197363508914994,17983287614789022640,1
