level,source,reply,post,language,language_variety,reply_id,post_id,majority_vote
1.0,twitter,@USER  @USER Sta cosa che la democrazia di un Paese sia commissariata dalla UE però deve finire. Dobbiamo poter eleggere integralmente ANCHE l'esecutivo e ANCHE le cinque più alte cariche dello Stato.,"“Su 55 obiettivi del Pnrr da centrare entro la fine dell’anno a noi ne sono stati lasciati 30” dice @GiorgiaMeloni.

Lo dica ai suoi alleati, che hanno abbattuto il governo Draghi 5 mesi prima della scadenza fissata dall’Ue, legandogli le mani.

Fate di meglio, se siete capaci.",it,it,5307133036813472424,7506023950185507249,0
1.0,reddit,"Mi sembra esagerato, dovresti lavarlo ogni giorno, io considero sempre e comunque il giubbotto e lo zaino un indumento/oggetto ""sporco"" dato che si lava di rado e tende a toccare superfici lozze, stacci un pò più attento, lavati le mani dopo che te lo togli quando torni a casa e fine.","Il post ha appena rilanciato la notizia che il virus può stare diversi giorni sulle superfici non porose ( citando  URL  ) . Qualcuno ha informazioni sulla disinfezione dal virus delle superfici porose? Vorrei lavare lo zaino (e magari anche la giacca) che uso sui mezzi, ma non posso mica lavarlo a 60 gradi o con la candeggina",it,it,1504352012483312751,6137842817478949354,0
1.0,reddit,"Fun fact a proposito della ISS: Pensa che un astronauta russo che doveva partire recentemente verso la stazione spaziale, è stato dichiarato inabile al volo. 
Cosa c'è di divertente? La causa che ha portato all' inabilità.
Qualche giorno prima stava passeggiando in un viale, ha pestato un ramo che gli è finito sull'occhio. 2 settimane di prognosi e (per lui) volo saltato.","Stavo pensando, ma sai come godono ora quei cristi chiusi dentro l'ISS?",it,it,5963027431525072599,4126799741340102724,0
2.0,twitter,@USER Grazie mille,@USER Auguri ?,it,it,8943778692711939532,1913506562317880272,0
1.0,reddit,M-ma il libero mercato europeo!,Gratis... Diciamo meglio che sono pagati con i soldi delle società con sede di comodo lì. In pratica glieli stiamo pagando noi,it,it,14736009073774645474,15051144082008871030,1
1.0,reddit,"ma non e' un po' esagerato? Dice che ha difficolta' per cose abbastanza casual e elementari (ma non patologico almeno) e... addirittura andare all'estero? Una nazione diversa, lingua diversa...",Io ti consiglierei appena puoi di uscire dalla tua zona comfort e provare un viaggio all'estero anche con il  workaround. Un' esperienza di lavoro condivisa puo' amplificare la voglia e la profondita' di un rapporto.,it,it,16009241735631829625,11760823865698079329,0
1.0,twitter,@USER Mannaggialadroga... USA le gocce...,L'esercito nazista è sul punto di crollare. Apposta i CRIMINALI USA e i loro servi UE strepitano come aquile. I Satanisti che li pagano non lo accettano perchè sarebbe la fine della loro Dittatura Mondiale detta Nuovo Ordine.,it,it,2616124266813447248,17539115194999755505,1
1.0,reddit,"Ciao. Ottimo post, bravo. Posso chiederti com'è la situazione ai maggiori valichi di confine? Ci sono controlli di sorta o tutti come al solito?","Ciao a tutti,
siccome mi è già stato chiesto più di una volta, ho pensato potesse essere utile. Sono ticinese e abito vicino al confine con l'Italia. Molte persone del nord Italia vengono a lavorare da noi e, data la situazione, sono giustamente preoccupate per eventuali azioni prese dal Governo verso italiani per limitare il contagio. Vi dico quello che so, sperando che possa essere utile.
Al momento non c'è in programma nessuna misura per limitare il flusso di frontalieri tra Italia e Svizzera. In generale, la gente è molto tranquilla e non ho visto nessun fenomeno di discriminazione verso lombardi, cinesi o codognesi. Le misure prese che potrebbero riguardarvi direttamente sono le seguenti.

Annullamento delle grandi manifestazioni (le piccole rimangono a discrezione del Governo)
Maggior informazione alla popolazione (ho visto volantinaggi alle frontiere e stazioni ferroviarie, oltre a cartelloni in varie aziende e luoghi pubblici)
Alcuni datori di lavoro (p. es. la televisione della Svizzera italiana) hanno deciso, dove possibile, di far lavorare i frontalieri da casa, mentre altri sono ora in ""vacanze forzate"" in modo da osservare lo sviluppo del fenomeno

I nuovi casi in provincia di Varese non hanno cambiato la situazione. Quindi, se il vostro datore di lavoro non vi ha comunicato di stare a casa, non avete nulla di cui preoccuparvi e dovreste continuare a lavorare normalmente. Allo stato attuale delle cose le scuole dovrebbero rimanere aperte, quindi se lavorate in quell'ambito non dovreste avere problemi.
Per quanto riguarda la situazione qui, la gente è relativamente tranquilla. I supermercati sembrano non avere molti problemi di scorte. I casi in Svizzera stanno (lentamente) aumentando, ma penso anche che non si stiano dando la briga di controllare più di tanto se non in casi sospetti.
A quelli preoccupati per la discriminazione voglio solo dire che gli unici che potrebbero rompervi le palle sono i soliti che ve le rompono tutto l'anno.
TL;DR: siete i benvenuti e vi auguro che la situazione nel vostro Paese possa migliorare presto!",it,it,3315856366481196823,1326748524004839752,0
1.0,reddit,"> ormai è normale promuovere modelle obese?
Mhh no? Anche la modella più curvy che io abbia mai visto, era solo sovrappeso (per quanto il confronto col BMI probabilmente verrebbe sfasato, perchè vedevi che la sua bella palestra per mantenere la carne nei punti giusti se la faceva)
A parte questo comunque, c'è dopotutto una effettiva asimmetria tra anoressia e obesità. Con una rischi di lasciarci gli stracci ogni giorno, e il legame con la patologia psicologica è praticamente biunivoco. Essere grassi invece.. boh, male, però non diventa una cosa ""esponenzialmente difficile"" da sistemare.","Qualcuno potrebbe gentilmente spiegarmi per quale motivo dovrebbe essere socialmente inaccettabile normalizzare l'anoressia come standard di bellezza mentre ormai è normale promuovere modelle obese?
Capisco benissimo che in passato ci sia stata una forte tendenza al normalizzare standard di 'magrezza' irrealistici, sopratutto per le donne, ma allo stesso tempo sia l'anoressia che l'obesità sono entrambi disordini del comportamento alimentare, ed a loro volta portano a diverse complicazioni, quindi trovo non sia giusto promuovere ne standard tendenti all'anoressia ne all'obesità, essendo entrambi 'stili di vita' malsani.
Penso sia necessaria una distinzione fra la promozione di standard di bellezza inarrivabili, o comunque malsani, e l'inclusione di una più ampia gamma di forme fisiche nel mondo della moda e delle pubblicità al fine di distruggere gli stessi standard di bellezza malsani ed inclusivi delle sole persone magre e in forma.
A questo punto, mi pare palese che le modelle in questione rientrano più nel campo dell'inclusione di più forme fisiche che nella promozione di standard di bellezza malsani, poiché, per lo meno secondo me, queste modelle non rappresentano l'ideale di bellezza fisica; giudicando esse delle promotrici di uno standard di bellezza malsano, si rischia di annullare un qualsiasi discorso a favore del body-positivity.
Malgrado le connotazioni storiche di questo problema, mi sembra poco corretto giudicare le modelle anoressiche delle promotrici di uno stile di vita malsano mentre le modelle obese sono viste come delle guerriere per la libertà delle donne; non si può essere inclusivi se non si includono tutti.
TL;DR: se queste modelle promuovono uno stile di vita malsano, perché le modelle obese invece promuovono l'inclusione di più forme fisiche?",it,it,5294697246259817887,4289679205748268221,0
1.0,reddit,Bugiardo. C'era un'ordinanza che impediva di disputare la partita di domenica. Doppiamente bugiardo.,"Tutto sto casino perché la juve ha problemi di spogliatoio e ha le pezze al culo in bilancio e quindi non vuole rimborsare i biglietti, che tra l'altro sta ancora vendendo per la partita col Milan (vediamo se la faranno col pubblico).",it,it,2855033613064965534,8903273293228760799,0
1.0,reddit,fatti piu pasta la sera prima e riscaldala al lavoro con il micro onde,"francamente la pasta al microonde sono tentato di provarla perché al lavoro ho quello e basta.
Risparmierei soldi rispetto ai piatti precotti da microonde.",it,it,4447881076993153011,16653175777918050962,0
1.0,twitter,"@USER  @USER Che ha fatto Lu?
Mi son persa un pezzo ahahah 
Vcmq ❤️ x Lu e x te Chri",Grandeeeeeee luchiiiiiiiiiiii???? @LDAilvero,it,it,13148380845718877384,5264278963776836815,0
1.0,reddit,rambo t'è caduta la bandana,"Ma nessuno che parla delle minacce a suon di colpi di arma da fuoco alla caserma dei carabinieri? Ne vogliamo parlare? Fossi stato un carabiniere sarei uscito all'esterno con un pm12 e avrei fatto tabula rasa, così poi vediamo se in futuro mai qualcuno si permetta di fare un affronto del genere. Datemi del fascista, ditemi che così faccio il loro stesso gioco, sti cazzi.",it,it,5294803959021646396,4127188764209178883,1
1.0,reddit,"Potrei sbagliarmi, ma in teoria non ci si dovrebbe fermare a far passare i pedoni a meno che questi non siano già sulle strisce. Mi spiego meglio:
Fermandoti all'improvviso per far passare qualcuno che ancora è sul marciapiede, potresti rischiare di essere tamponato da dietro, proprio per la fermata improvvisa specie se quello dietro è distratto e/o non rispetta la distanza di sicurezza. Un altro motivo sarebbe che rallenteresti il traffico inutilmente, un po' come in autostrada/superstrada quando non si rispettano le distanze e si creano rallentamenti anche se non ci sono incidenti o altro.
Discorso diverso se tu sei già piuttosto lontano e vedi che qualcuno sta già attraversando, oppure, a causa del traffico, sei già fermo o vai pianissimo. In questo ultimo caso dovresti lasciare libere le strisce e liberi gli incroci.","Chi non rallenta quando vede qualcuno avvicinarsi alle strisce e guardare in ambo le direzioni, evidente segno che questo qualcuno vuole attraversare, è uno stronzo.",it,it,16929324424724328379,1679936900363829468,0
1.0,reddit,"Sarà in quarantena, ha superato i famosi 65 anni, gli mancano pezzi random di polmone e può tranquillamente fare telelavoro non impestando sé e le folle (che si cross-impesterebbero, pun intended) per andare a vederlo. Mi sembra responsabile.
Hanno radio vaticana, tv2000 e i vari canali web, può benedire e parlare benissimo da lì.",su r/coronavirus gira voce che anche il papa se l'è beccato.,it,it,11367230220820660034,17054408163804102121,0
1.0,twitter,@USER Grazie per l’informazione…posso andare a letto tranquilla sapendoti al sicuro “dalla parte giusta”… ma scusa tu chi saresti?!,Da oggi sono ufficialmente un’iscritta al M5S. #DallaParteGiusta,it,it,8793596342129188254,15166726173020555620,1
1.0,twitter,@USER Ma anche si,Mi leccheresti la figa se te lo chiedessi gentilmente?,it,it,15985819287471218724,2026724236652621339,1
1.0,reddit,"Lui ha diritto ad ottenere un secondo parere, se è stata malasanità o no lo può decidere solo chi ha tutte le carte sotto.","Non siamo negli USA dove fai causa per ogni cosa.
C'è stata una complicazione che può capitare, l'hanno risolta e non hai avuto ricadute.
Parlare di malasanità in questo caso è ridicolo visto che non c'è stata negligenza. Dai, imparate a stare al mondo e piantatela di usare reddit come Yahoo Answer",it,it,5052217914315752605,17508111459171281783,0
2.0,twitter,@USER Ciao caro,@USER Ciao meraviglia,it,it,1918133846422175504,11546570625170656765,0
2.0,twitter,"@USER  @USER Basterebbe togliere i finanziamenti ai CAAF e ai sindacati, verificando le pratiche inerenti.",@USER Tenendo conto che gli stranieri in Italia raggiungono quasi il 10% della popolazione direi che non serve essere razzisti per capire che esistono organizzati mafiose che lucrano su questa cosa.,it,it,16689220773816975422,3938851121425290894,0
1.0,twitter,@USER Non siamo distanti. Se vuoi ci sono ?,"Ho voglia di conoscere qualcuno per andare a prendere un caffè insieme, spettegolare un po' e cazzate così. È brutto non avere qualcuno con cui confidarti",it,it,10110647834930219656,9507132506088029129,0
1.0,twitter,"@USER  @USER Maieutica, si definisce in filosofia... ???","Cliente: ieri.mi hai dato la seppia era durissima
L quanto l'hai cotta?
C un'ora e mezza
L e io quanto ti ho detto?
C 10 minuti
L quindi?...
Non posso dire apertamente ai clienti che sono idioti ma ce li posso far arrivare piano piano col ragionamento",it,it,13838137516189811851,14450416039086027878,0
1.0,reddit,"Scusa, avete provato a localizzare il telefono? Sapreste subito se l'ha lui.","Sabato sera c'è stata una serata con 20/25 persone a casa di un amico, tutti grandi amici, chi perché stavano in classe insieme al liceo, chi perché semplicemente fa parte del gruppo di amici del padrone di casa.
Alla serata precedente, sempre svolta a casa di questo ragazzo, qualcuno ha rubato il portafogli alla ragazza di uno dei miei migliori amici per poi farlo ritrovare in una specifica zona di Roma (non so bene i dettagli di questa parte, Non so nemmeno come siano riusciti a ritrovarlo o cosa ci fosse ancora dentro).
Per evitare che una cosa simile risuccedesse, stavolta il proprietaroi di casa ha adibito una stanza a guardaroba e la apriva e chiudeva a chiave ogni volta.
Cosa intelligente, si, ma non è servito, visto che a fine serata è scomparso un telefono che si trovava sul tavolo dove stavamo mangiando e bevendo, telefono appartenente ad una ragazza.
Fin qui, sembra una storia normale di un ladruncolo qualsiasi, un po' infame perché sta facendo un danno ai suoi amici, ma il giorno dopo la storia prende una piega surreale, sembra quasi trasformarsi in un episodio di diabolik:
Alcuni ragazzi la mattina dopo la festa si ritrovano per fare una partita a calcetto in un campo sportivo in un'altra zona di Roma. Diciamo che son coinvolti circa 10 ragazzi di quelli presenti la festa, 8 circa avranno giocato e 2 son passati a vedere gli altri che giocavano. Finita la partita, uno di questi ragazzi che sta andando verso il parcheggio quasi calpesta una cover, la raccoglie e scopre essere la cover del telefono rubato. Accanto a lui c'erano altri due ragazzi, quindi non può aver inscenato niente, sembrerebbe che i sospettati siano i 4 ragazzi usciti prima di loro, tra cui, almeno uno, è venuto solo per guardare un po' la partita e poi andarsene. Il sospetto che abbiamo io e il mio amico che ha raccolto la cover sono purtroppo proprio su quest'ultimo ragazzo. Dico purtroppo perché fa parte della nostra cerchia di amici più stretti.
Non avrebbe avuto motivo di farlo considerando che è un ragazzo benestante, ma a questo accaduto si aggiunge anche il fatto che il portafoglio rubato sia stato ritrovato proprio nella zona in cui abita lui.
In tutto questo la ragazza sta per andare a denunciare il furto e il padre del ragazzo che ha fatto la festa aveva installato delle telecamere nel salotto dove il telefono è scomparso, telecamere che potrebbero aver ripreso qualche ragazzo che fumava ""sigarette corrette"", quindi si sta cercando di risolvere tutto con calma, si è data pure la chance al ladro di consegnare il telefono impacchettato ad un indirizzo e avvertire facendo una chiamata anonima, ma sembra non volerlo fare.
Di tutta sta storia, la cosa più assurda sta nel fatto che chiunque sia il ladro, sembra che si diverta a lasciare una traccia, da far trovare agli altri.
TL;DR: festa tra amici, qualcuno ruba un cellulare e denota tratti da psicopatico lasciando  ritrovare la cover da tutt'altra parte come indizio",it,it,18195580479243913346,11575819180699822909,0
1.0,twitter,@USER Praticamente tutti,"Io non sono mai  riuscito a capire perché nelle TV  italiane ci sono conduttori e conduttrici Come:Floris,Formigli, Giordano,Berlinguer, Gruber, Panella,Palombelli,Merlinoe altri che non mi vengono  in mente. Cosa abbiamo  fatto di male???",it,it,6358354047264580474,13085519918698530011,0
1.0,twitter,@USER Contro il potere delle banche è meglio !,Non credo che esista nel mondo civilizzato un altro Paese il cui governo fa la guerra ai pagamenti con carta di credito o bancomat,it,it,16856958995869695592,12440347481004767015,1
1.0,reddit,"Io sono abbonato da quasi un anno. Abituati al pattume italiano è un prodotto di un altro pianeta: al di là della politica che pure ne occupa uno spazio importante, ha una vastità di temi impressionante, un sacco di reportage in giro per il mondo, approfondimenti nella sezione Opinion. Per me è da provare.",Chi di voi legge il New York Times? Cosa ne pensate?,it,it,5576895357173609519,3994977464894414197,0
1.0,twitter,@USER Buona domenica Oreste ??,@USER Buona Domenica Giusy,it,it,2073501803852256665,12556933444267077394,0
1.0,reddit,Ironico che lo chieda tu con il tuo username,"Domanda che non c'entra nulla, come si arriva ad avere 110k euro annui di debito?",it,it,4092243886149381378,7052809677862322774,1
1.0,twitter,@USER E diciamolo,"Lo scrivo per tanti idioti che rispondono ai Twitter come le pecore.
Sono un Sovranista, non sono vaccinato, non pagherò la multa e la mia Libertà non è in svendita.",it,it,1458015100847778173,3045493691802176106,1
2.0,twitter,"@USER Si sì, e anche di più",@USER Ieri 20^?,it,it,15112272576644350676,17598935040650533348,0
1.0,reddit,Non sono un biologo ma penso usino la reazione a catena della polimerasi per fare i test in Italia (PCR). I famigerati kit che usano negli altri paesi non so come funzionino.,"Ho una domanda da eli5 o eli10, come funziona chimicamente il tampone?
Cioè una volta che hai la saliva del tizio, come vedi se c'è il covid19? Reagisce a qualcosa? Lo fai moltiplicare finché non diventa abbastanza fitto da guardarlo al microscopio e vederlo? Lo chiami e vedi se risponde?",it,it,15614126963798227274,12784091225944356843,0
2.0,twitter,@USER  @USER  @USER  @USER guarda chw è a dieta il povero pdiota... vive di sola aria e piccolo assegno rdc.???,"@USER  @USER  @USER Prima di parlare, faccia un po' di palestra un PD con quella pancia significa che mangia troppo! ???",it,it,9954440018523839361,3044065223273125996,1
1.0,reddit,"Mi pare di sentire l'azienda piuttosto comprensiva quindi spero non serva 
Ma è legale registrare così una conversazione? Lol","Quando vai a parlarci mettiti il telefono in registrazione e mettilo in tasca, spiega per filo e per segno che è successo, se ti danno fogli digli che non vuoi firmarli menzionando cosa c'è scritto imho.
Intanto andrei dal sindacato.",it,it,10861168795975057867,3162843160908179333,0
1.0,twitter,@USER È uno dei figuranti a gratisse in monte Mario....uno di loro insomma,"Siamo riusciti a far twettare la AS Roma, in difesa di Damiano, quanto cazzo siamo cafoni",it,it,12060265813653693304,13736144961596263000,1
2.0,twitter,@USER Devo ammettere che ogni volta che la vedo spengo… non li guardo per istinto di auto conservazione ???,@USER Ma non notate che le espressioni sue sono le stesse che xon niki ? Ho sono io che sto vedendo altro???,it,it,16962225492024177094,13268918164449319838,1
2.0,twitter,"@USER  @USER Compresi Dalla e, che ne so, Conte e Battiato?","@USER Tutta la musica italiana, senza alcuna eccezione.",it,it,6007011394876944453,15404473547202726268,0
1.0,twitter,@USER Vero era ora ieri ero incavolata e me la sono presa un po con Anto poi ho visto quello che dicevi tu e mi sono fermata hai ragione non bisogna prendere le parti di nessuno dei due...ma Edo ha un piccolo cuoricino in più!Grazie sarò più equa,Bentornato Edo del mio cuor .. mi eri mancato ❤❤#donnalisi,it,it,4912903046788000024,10430056777779181244,0
1.0,twitter,"@USER Se parli sul serio dammi la tua figa, sei speciale",Posso mandarti una foto della figa?,it,it,6794677258638916499,17523138090480937068,1
1.0,reddit,"Lo facevo notare a qualcuno su reddit qui, che prima che si venisse scoperto in Italia bisognava vietare l'ingresso a tutti gli asiatici, ora le nazioni che sconsigliano i volo per e dall'Italia stanno esagerando. 
C'è stato un 180 generale su reddit per quanto riguarda i blocchi","Sono expat e di origine asiatiche.
Tempo fa, prima che il virus arrivasse in italia, scrissi un post dove dicevo che tanti italiani expat mi facevano battutine varie. Niente di che eh, figuriamoci. Sottolineavo semplicemente come sia la quantita' della cosa invece che l'intensita' a pesarmi. Era una mitraglietta quella situazione ecco.
Oggi e' rispuntato l'argomento virus tra chiacchiere varie. Essendo expats si parlva quindi delle misure Europee e attitudine della gente in generale nei confronti degli italiani . E giu' a dire della genteh scema, delle psicosi e robe.
Fino a quando c'era da perculare, tanta allegria. Ora che i ""negrih"" siete voi* fanno i moderati e illuminati del pensiero critico. 
Non so se essere mezzo incazzato o mettermi a ridere.
&#x200B;
*voi intendo quelle persone, non il sub o chi legge.",it,it,10970383393099074485,6651249378556408640,0
1.0,twitter,"@USER Buongiorno e buona giornata anche a te grazie, buona domenica ❤️",Buongiorno tesori ?,it,it,883896897413808280,11836647547306398378,0
1.0,reddit,"È quello che passa per Settebagni, Fidene e Monterotondo? Lo prendo spesso.","Ma che cazzo è successo stamattina?
 URL 
Che rodimento di culo",it,it,14549107006397686832,725620426700879862,0
2.0,twitter,@USER Buongiorno,@USER Ciao,it,it,9884055913407993889,14484916380122592851,0
1.0,twitter,@USER Poi cosa fai con il mio numero di cellulare?,E se scambierei il numero di telefono con il tuo ?,it,it,8442578906604510520,6614655654030475176,0
2.0,twitter,@USER Mi piace!,"@USER Aziendale, ma scelta da me
Suzuki Ignis",it,it,5763583848249270252,17255684909645560827,0
1.0,twitter,"@USER  @USER  @USER Personalmente (e credo con me tanti altri) non voterebbero mai un partito neomarxista e che non abbia nella propria costituzione economia e società aperta, europeismo ed atlantismo.","Se noi dicessimo che se vince @sbonaccini, lasceremmo PD, l’esimio sindaco Bergamo  @USER come ci rimarrebbe?

Cosa penserebbe?

Vogliamo tenerlo unito il PD o sfasciarlo per sempre?

Può essere che debbano essere sempre i militanti a riparare le boiate dei dirigenti?",it,it,1659662918825816520,2183298208234048920,0
2.0,twitter,@USER È la mia ombra…come vedi mi segue anche in bagno…??deve controllare..,@USER carinissima...,it,it,15615219987463498429,11105485630848101915,both
2.0,twitter,@USER Buongiorno ?,@USER Buongiorno,it,it,80841893670669734,6610579126403192904,0
1.0,reddit,Non gli ho ancora assaggiati ma mi fa ridere chi criticava i 3€ dei biscotti alla nutella mentre il prezzo al peso di quelli pan di stelle è quasi il doppio,I nutella biscuit sono una merda ma quelli nuovi dei Pan Di Stelle sono orgasmici.,it,it,2928215768332232853,3078947007140051398,0
1.0,reddit,"Io purtroppo uso poco Facebook per questione di privacy. Oltre instagram, uso pure Twitter.","Facebook di gran lunga. Tra pagine ufficiali e gruppi trovo sempre discussioni interessanti e cose di cui non avrei saputo l'esistenza se non più in ritardo.
E no. Non è /s.",it,it,15143542361652601798,8024435464077111998,0
1.0,twitter,@USER Non ti ricordi le intercettazioni uscite?,"Immagino le telefonate tra Giuntoli e i dirigenti del Lille per acquistare Osimhen con 3 ragazzini mandati in Francia per abbassare il prezzo del cartellino (15 mln in 3) che adesso ""giocano"" con Turris, Nocerina e Casoria.

Parliamo di serie C, D e Eccellenza.",it,it,4778898205091755102,4564608620777434813,0
1.0,reddit,"oltre a quello che dicono gli altri aggiungo: Non aver paura a spendere qualche € in più per un modello un po' più carino, sono dispositivi che durano veramente una vita, e la tecnologia per leggere un libro non è roba spaziale, la differenza tra un kindle di tempo fa e un kindle attuale non è così abissale
fonte: un Kobo Glo acquistato nel 2012 che non vuol morire",Quale eReader mi consigliate?,it,it,14743411536336141856,17377687437301113266,0
1.0,twitter,@USER E chi lo pagherà adesso?,Pare che la Regione Sicilia abbia tra i 6 e i 7 miliardi di disavanzo.,it,it,16827063574451536646,17294355859312949251,0
1.0,reddit,"Forse intendevi:
surprisedpikachu.jpg

^(Questo messaggio è frutto di un intervento manuale)
^(Informazioni)
^|
^(Dimmi cosa ne pensi) ^(mandandomi) ^(un) ^(PM)
^|
^Cancellami","Decide di fare il pornodivo
Cambia carriera 
La gente si ricorda che faceva il pornodivo
Lui: suprisedpikachu.jpg",it,it,2571994342401667778,10040333286381417447,0
2.0,twitter,@USER  @USER Con dietro il tecnico delle luci ?,@USER  @USER Che sogno,it,it,7894618451895734555,8442889480731967876,0
2.0,twitter,@USER Non credo...,@USER Susy fai anche un salto a San Luca?,it,it,15915558572287849870,7583137707705681454,0
2.0,twitter,"@USER Grazie, ma si mio ho messo poco!",@USER Bellissimo! Bravo fotografo ???,it,it,2690082982283392225,5512108323570190442,0
1.0,reddit,La parte investigativa è molto valida in realtà.,Detto dal direttore di Buzzfeed? Hahahahahaha,it,it,9957783211819774437,10129664068498287827,0
2.0,twitter,@USER  @USER La risposta è nel nome chi scrive: pallone gonfiato,@USER Chi è Bargiggia?,it,it,8072238042250817773,3646463276755959524,1
2.0,twitter,"@USER hai ragione, devo cambiare regalo",@USER dai non me lo dovevi spoilerare così,it,it,6492037401386175429,10704360722010704111,1
1.0,reddit,"Si, se la segui. Chi ha detto che seguono la dieta mediterranea?",Ma come? La dieta Mediterranea non e' la migliore al mondoh?,it,it,5870254701317464152,1556312688180013816,0
