level,source,reply,post,language,language_variety,reply_id,post_id,majority_vote
2.0,twitter,"I nostri politici, con i soldi che guadagnano onestamente, governandoci bene, facendo prosperare la nostra economia e migliorando le nostre vite, possono e devono farci quello che vogliono, come tutti noi. La logica populista, che venga da destra i sinistra, fa schifo.","Direi che per me Bersani si può vestire pure d’oro 24 carati dalla testa ai piedi, visto il contributo positivo che ha portato all’economia Italia, rendendola più giusta, concorrenziale e moderna. Al contrario di chi oggi vuole farci tornare un’economia con logiche da terzo mondo",it,it,9892206048701120869,13779088126072596997,0
1.0,reddit,"I soliti incentivi di viaggio sui treni, sicuramente.","Che voi sappiate, ci saranno incentivi per i fuorisede? Altrimenti non so come fare per votare",it,it,14860368999988079724,443287622483109528,0
1.0,twitter,@USER Hai ragione Marta,"Lo sfascio della società è secondo me il delirio di una persona in salute che si lamenta con una come me.

No, non sono più importante di altri ma è di cattivo gusto, e ingiusto, farsi paranoie inesistenti raccontandole a me che lotto per vivere.

Ne sono satura.

#IoNonMollo",it,it,11757901569502204785,15138782880676528306,0
1.0,reddit,"Ma magari... sono dovuta venire in uni, stamattina. Maledizione a UniTN che riprende i corsi appena dopo che l'OMS ha deciso di portare il rischio di diffusione da ""alto"" a ""molto alto"" a livello globale.",Quanti pronti a guardare le lezioni online dal divano con le loro pantofole indosso ?,it,it,1205260215288053669,13682788273194610572,0
1.0,reddit,"io pago due giornali, il NYT ed il posto, 10€ al mese in totale, ma che valgono molti molti di più per quanto mi fanno tornare indietro sottoforma di cultura e conoscenza  
Se repubblica o corriere avessero anche solo un 30% della qualità e del servizio ( incluse le app ed il sito ) che da il NYT sarei disposto a dare anche 20€ al mese ad ogni testata  
Ed invece abbiamo R+ e le sidebar del corriere pieni di culi e fakenews",Chi di voi legge il New York Times? Cosa ne pensate?,it,it,13787360226521261322,3994977464894414197,0
2.0,twitter,@USER Buongiorno,@USER Buongiorno ☕???,it,it,13325518203488674949,6517886076043862325,0
1.0,reddit,Quanti morti stiamo facendo?,Quanto PIL ci stiamo bruciando?,it,it,14278385778710598219,10281194885854020219,1
1.0,twitter,@USER  @USER ?????,"SPESSO FACCIO COSE PER CUI IO STESSA MI DICO:"" ma sei cretina?...
E IO STESSA MI RISPONDO:""sì e allora? Problemi? Fatti i cazzi tuoi""...

Sono io??",it,it,7454813651582082927,1772110225560483874,0
1.0,reddit,"E' normale un picco nei primi giorni. La mia personalissima e non scientifica previsione è che arriveremo nelle prossime 2 settimane a 3000-5000 infetti su base nazionale e poi ci sarà una graduale diminuzione, molto lenta.","Ho appena guardato i numeri per l'Italia, fanno un po paura. 
 URL",it,it,2663571073661424811,12418437534432841055,0
2.0,twitter,@USER  @USER Verissimo e tristissimo. 2 cuori e una capanna è una favoletta per bambini...,@USER Ci sono donne che stanno con uomini che non amano per il loro stipendio la casa il benessere,it,it,8729984433028406969,8024824411769983282,0
2.0,twitter,@USER  @USER Cosa pretendi da un sovranità no vax? Chen abbia anche un cervello funzionante?,"@USER Rispondono ai Twitter???
Meglio che non parli di idioti e pecore ?",it,it,11499789980177999013,3564946252259166350,1
2.0,twitter,@USER  @USER ? ? ? ? ? ?,@USER Non riescono a venire fuori da questa storia che si sono creati da soli..confrontati con Renzi sono dei nani.,it,it,11761195244531997052,11210868967889288071,0
1.0,reddit,Infatti non sapevo nemmeno che ci fosse,"80% degli italiani: ""Quale referendum?""",it,it,13142359696473192841,9995600610525403094,0
1.0,reddit,"Trump è così sicuro di sé quando solo 5 stati hanno kit per testare e la California si è già lamentata che i kit non funzionano bene, nel paese in cui la gente non va al ER a meno che stia morendo dissanguata e prendono Uber piuttosto che l'ambulanza voglio proprio vedere che bella roba uscirà, già un cittadino proveniente dalla Cina è stato forzato a fare il test, la sua assicurazione ovviamente non copriva perché vale solo in Cina e ha dovuto pagare 3,6k per un test che è stato forzato a fare dalle autorità, land of the freeeee","A causa del sistema sanitario e delle politiche sul lavoro, gli Stati Uniti potrebbero essere i più vulnerabili al coronavirus ...e sopratutto quanti malati di quella che potrebbe sembrare un’influenza) senza assicurazione andranno veramente a farsi controllare/diagnosticare? Hmmm...",it,it,12570602740796219346,13420040223741002836,0
1.0,twitter,@USER Se devi fare follwer si,Devo pubblicare una foto della figa?,it,it,6876182389500383664,6386761469479287029,1
1.0,reddit,"""e ha pugnalato a morte due funzionari"", non è semplicemente scappato.","Quando leggi certe cose: Prima pena di morte in Cina per uomo che tenta la fuga da Wuhan ...ti accorgi di quanto è bello vivere in democrazia è stato di diritto. Pazzesco, condannato a morte dopo neanche un mese dai fatti...chissà che bel processo in neanche un mese con la situazione attuale poi.",it,it,4967704641671637129,199197615758792385,0
2.0,twitter,"@USER Grazie, è femminuccia ?","@USER Sembra che dica : "" ma perche' scusa a che serviva sto coso? "" 
?quant'e' bello il micio",it,it,12866248940929811389,14600356769401745280,0
1.0,reddit,"Quello è scontato, quasi tutti i turisti stranieri che hanno contratto il virus ultimamente, e che sono riconducibili all'Italia, dicono di essere stati a Milano.",Ma sono solo io che credo che a Milano ci sia un focolaio enorme e nessuno lo dice? Nel senso confortante da un lato perchè se c'è un botto di gente asintomatica o con sintomi lievi la mortalità o i pazienti gravi sono in percentuale inferiore... or just wait for it when its too late? (ovviamente come in tutte le altre megametropoli del mondo),it,it,6791546829028638644,290502069783292363,0
1.0,twitter,@USER Ciao??? buona domenica,"Mi guardo intorno e penso alle case perfettine degli altri,mentre la mia è imperfetta a tratti disordinata,con le tende con qualche buchetto,io ho scelto di adottare un gatto. La vita è una questione di scelte,io ho scelto l'amore. ?❤ buona domenica ?☕",it,it,497747122284914787,16999841606409157249,0
1.0,reddit,"vai su /r/China_Flu loro saranno felicissimi di ascoltare tutte le teorie del complotto, anche la frenologia sul recettore ACE2 andava alla grande quindi non serve impegnarsi","Si potrebbe fare un sub a parte dove si elencano tutte le teorie cospirazioniste riguardo al Coronavirus? 
Ieri un mio amico asseriva che ci sia già la teoria del complotto per la quale l'America ha voluto colpire la cina e l'Italia per via dell'accordo sulla via della seta.",it,it,8178514984662953460,7954843239286609472,1
1.0,reddit,Basta chiedere ai clienti di andare in giro tipo le ballerine volanti,"Ho una domanda, gestisco un bar all'interno di un museo in Lombardia, il bar ha servizio diretto al bancone ed ha 7 tavolini con un totale di 30 sedute.
Ora mi chiedo dopo che ieri si enfatizzava il discorso ""droplet"" quindi garantire distanza dei fruitori di almeno 1 metro l'uno dall'altro. Come è attuabile in un bar? Chi è preposto al controllo di tale regola? Sarà possibile servire al banco o solo ai tavoli? Grazie",it,it,17520746427191105100,492369763312032140,1
1.0,reddit,Abbiamo appena superato a livello globale il numero di morti del 11 settembre (che era 2996),Testa a testa tra Francia e Germania per il secondo posto in Europa,it,it,18023797958096598973,7111337847746781756,0
2.0,twitter,@USER Esatto ?,@USER Ma non pubblicatele per nulla che schifo i piedi,it,it,11913850470339052412,10184219531185448969,0
1.0,reddit,"Ti cito un grande professore:
""[...] Io voterò convintamente NO essenzialmente per tre ragioni. 
La prima: con la attuale legge elettorale e con listini bloccati e candidati nominati, i nuovi parlamentari saranno tutti indicati dalle segreterie di partito, sottraendo di fatto al Popolo sovrano totalmente il diritto di scegliersi i suoi rappresentanti. Deputati e senatori risponderanno al segretario del partito e non più agli elettori. 
La seconda: con questa riforma la rappresentanza politica sarà concentrata nelle aree più popolose del Paese, a scapito di quelle con meno abitanti ma territorialmente più vaste, ed inoltre non tutela in modo adeguato le minoranze linguistiche. 
La terza: eletto ed elettore, non avranno più legami e ciò favorirà ancor di più il distacco dei cittadini dalla politica, ampliando l’astensionismo e il disinteresse nei confronti delle pubbliche Istituzioni, soprattutto del Parlamento, l’unico luogo dove il cittadino dovrebbe vedersi democraticamente rappresentato. Un Parlamento con meno eletti, per giunta nominati, creerà di fatto una nuova cerchia ristretta di potenti.""
Se vuoi leggere tutto il discorso dal quale ho estratto solo le conclusioni: fonte","Per chi voterà no, potete spiegare le vostre ragioni? Principalmente perché è da anni che si continua a ripetere di voler diminuire il numero dei parlamentari per adeguarsi alla media europea, e questa sembra un'occasione per almeno avvicinarsi a quel numero.",it,it,13873332991979391873,4041366564795162535,0
1.0,reddit,Tranquillo che stasera ci risaliamo purtroppo,Siamo ufficialmente scesi dal podio signori,it,it,7580355702657891160,9470135544203662717,1
1.0,reddit,a me da' fastidio quando viene usato per dire quello che si pensa ma non prendere downvote,Odio l'uso smodato dei /s su r/italy,it,it,2298606326865364639,9720699699895390632,0
1.0,twitter,"@USER No, non ne avete mai avuto storie, ma soprattutto una storia","Per giustificarsi escono fuori storie sul Napoli del 1990
Storie sull'Inter del 1950
Storie sul Milan probabilmente del 1899.",it,it,699644003890646908,11899879421757476087,1
1.0,reddit,"> educati per dire che e' merda + non esaltati della propria cucina come gli italiani.
Questo non torna particolarmente con la mia esperienza personale.","Ci sono ragioni storiche
 URL 
&#x200B;
Intanto portate un japponese al ""sushi"" sotto casa da voi. Voglio vedere cosa dice.
Ah no scusate, i jappo sono prima di tutto tremendamente (pure troppo) educati per dire che e' merda + non esaltati della propria cucina come gli italiani.",it,it,15520102985964242659,11733505131862705089,0
2.0,twitter,@USER Buona domenica,@USER Buongiorno,it,it,2171221026918020370,7473603831227968071,0
2.0,twitter,"La domanda è: non sarebbe meglio che i politici e giornalisti al seguito, svolgessero  lavoro per cui vengono pagati dagli elettori? Li paghiamo profumatamente.
Non so se ho reso l'idea.","Viviamo un un periodo storico bellissimo! Il covid19, oltre alla influenza, ha fatto sparire anche il virus HIV.",it,it,9463529814559283694,3666153924860849034,0
2.0,twitter,@USER Sono veramente fuori di testa. Che caxxo,@USER Dove lo vuoi il monumento ?????,it,it,13940119255934347020,15364926777618185059,0
1.0,reddit,"> Some patients may have aches and pains, nasal congestion, runny nose, sore throat or diarrhea 
Preso dal sito ufficiale del WHO sul coronavirus. Il naso che cola può essere un sintomo.
&#x200B;
Vabbè dai, almeno non ha la diarrea",Tra l'altro oggi ho anche un amico in panico perché era nella discoteca di Carpi dove è andata a ballare una ragazza potenzialmente a rischio contagio e ora gli cola il naso (che non credo sia un sintomo) ad ogni modo lo scemo si è anche baciato con una ragazza di cui non ricorda nulla... Chi l'avrebbe mai detto che in periodo di pandemia NON ogni buco è Galleria...,it,it,11858972309289678173,8482609725250126267,1
1.0,reddit,"Non si può esportare democrazia in Vaticano signore!
SemiCit.
 URL","Psst ehi bambini veneti
La volete un po' di DEMOCRAZIA?",it,it,10391367793507987684,2968926351009075011,1
1.0,twitter,"Semifinale Coppa Italia anno scorso col Milan, prestazione straordinaria..Non contano le partite, Lautaro non è un top player, perché è tremendamente discontinuo, ed i suoi periodi no, durano a volte dei mesi dove l'anno scorso 4mesi senza segnare, ci hanno fatto perdere lo scudo","La stronzata più grande che si può scrivere su Lautaro, è che non incide nelle partite decisive. Io che sono molto critico con lui ed ho già detto che è solo un ottimo attaccante, vale Firmino. Ha vinto una Copa América da protagonista, in Champions ha segnato a tutte le grandi",it,it,3264213882665395886,64129031586958699,0
1.0,reddit,"> L'iscrizione alla precedente laurea, normativamente, decade
Il contrario: sono nulle le iscrizioni successive alla prima, non le precedenti all’ultima.","L'iscrizione alla precedente laurea, normativamente, decade e non è più valida. In ogni fase di nuova immatricolazione c'è o una casellina da barrare o un documento da compilare a parte dove dichiari di non essere già iscritto ad altri corsi o master perciò stai dichiarando il falso - con i relativi risvolti legali.",it,it,14576201922292918971,18028464297694704212,0
2.0,twitter,@USER Augurissimi !!!!!,"Grazie a tutti di cuore per gli auguri! ?
Molto sorpresa di non aver ricevuto commenti tipo ""scappa finché sei in tempo"" oppure ""ma chi ve lo fa fare"", ero già prontissima.",it,it,10431651884822600573,16164005459240018621,0
2.0,twitter,@USER Grazie,"@USER E allora, AUGURI ??",it,it,18322006677162402034,17754196737287640502,0
1.0,reddit,"Quindi dato che ho un Rolex al polso, sei autorizzato a rapinarmi?","Andare in giro con un Rolex al polso a Napoli lo sanno tutti che non è una best practice. Fare le rapine lo sanno tutti che non è una best practice. Secondo me non c'è UN colpevole, ma solo vittime. Compresi i colleghi del Carabiniere che per i prossimi mesi/anni dovranno lavorarci lì e la comunità che dovrà convivere con quella tensione sociale.
*edited*",it,it,1206181939592110880,7477401530957352384,both
1.0,twitter,"@USER Bravo Gio' ,sono d'accordo","Però se dovete vedere tutte le partite per poi criticare i giocatori dell’Inter facit na cos stutat a televisione accussì nun ce facit ò chinott’

#ArgentinaAustralia #qatar2022 #worldcup",it,it,8213125971845107721,16452488058483867918,0
1.0,reddit,"alcuni vanno offline, soprattutto amatoriali, o sono coperti da pesanti paywall quindi quando finalmente li trovi in chiaro è meglio salvarli prima che vengano rimossi da un richiamo per copyright",Io non ho mai capito perché si dovrebbero salvare i porno. Perché? Per quando non c'è internet?,it,it,14913044531952176628,16167343742615103161,0
2.0,twitter,@USER Mmm non sono proprio convinto,"@USER Un mix di serie già viste. Il successo penso sia dovuto solamente alle peculiarità ben note del personaggio stesso, ma l'ho trovato troppo adolescenziale.
I due film degli novanta &gt;&gt;&gt;",it,it,10444722898044119901,9876805870883428544,0
2.0,twitter,@USER Soprattutto Nikla. Tigrotta è più discreta.,@USER Tutti in trepida attesa ????,it,it,15948167978896004945,16971453668517499625,both
1.0,reddit,"Vuol dire sulle colline vicino a Padova, i ""colli euganei"".",Solo parlo un po d’italiano - cosa vol dire “euganeo”?,it,it,5785912418121084123,16662029180716713019,0
1.0,twitter,@USER Ma voi cosa c….avete fatto ? Sino ad ora ci vuole proprio bla faccia di bronzo della Malpezzi per criticare un governo che si è appena insidiato?Ma non vi rendete conto di essere ridicoli?,"La destra di governo che con la legge di bilancio strizza l’occhio a furbetti ed evasori, mentre taglia sanità, scuola e pensioni, mette a rischio il PNRR. Lo dice la Corte dei Conti. Il Paese ha bisogno di altro: qualcuno lo dica a Salvini e Meloni.",it,it,3285271782811118620,16401310761959942705,0
1.0,reddit,È così fragile? Pensavo fosse difficile bissare la Delorean,Peccato che il modellino costruito ha la brutta tendenza di smontarsi da solo,it,it,9688064331281294454,13943343828615455796,1
1.0,reddit,"Quelli per cuocere tutti i cibi in tanti modi, duh
O forse questi :p",Che cazzo sono i sedili multicottura della pubblicità Mercedes alla radio,it,it,9901376417448567248,888612363643747745,1
1.0,twitter,@USER Ma non ha detto niente di che ahahah,Aiuto Adani è impazzito pure oggi,it,it,1540406445131408239,12797430447485372137,0
1.0,twitter,@USER Un urlo per gli Articolo 31! Cit.,MA GLI ARTICOLO 31 A SANREMO URLOOOO,it,it,12781463199239106634,3983558760901871592,0
1.0,reddit,Lol. Assurdo. In UK è il contrario. Ho sempre negoziato un 5-10k in più quando menziono che ho altri colloqui.,"Non l'ultimo che ho fatto (l'ultimo che ho fatto, poi mi hanno assunto), ma uno degli ultimi... Azienda web medio/grande milanese, nota a pochi, ma con tanti dev.
HR, si presenta con un mio cv di 5 anni prima (chissà dove l'aveva preso) e dopo le solite domande introduttive: ""Ecco, vorrei sapere se stai facendo altri colloqui"" - ""Sì, certo"" (me l'hanno chiesto in molti, non ho mai nascosto la verità)
Faccia rabbuiata dell'HR: ""Eh, non ti faccio fare il colloquio tecnico, tu devi essere convinto di voler lavorare per noi e cerchiamo gente che voglia solo lavorare con noi!""
Io la guardo e le faccio: ""Non siete mica google"" (la prima cosa che mi passava per la testa)
Mi ha accompagnato alla porta. Credo di aver schivato un bel proiettile.",it,it,15338769570230191980,12650296792333791569,0
1.0,reddit,Una bionda che abbonda,"Ho sentito una ragazza che diceva ""io sono TANTA"".",it,it,7681944978638246803,16300389213436496259,1
1.0,reddit,Ma poi qualcos’altro della tua vita ti starà comunque sulle palle,Riuscire a farmi degli amici :'(,it,it,17907323798396250315,11854247542220259733,1
1.0,reddit,"che tristezza, sembra l'unica cosa che conti al mondo siano i soldi -.-'
l'avessi saputo prima non avrei sprecato il mio tempo a tentare di farmi accettare per ciò che sono (gay), ma mi sarei subito messo ad accumulare denaro :D","Il punto non è che cosa si mangiano i cinesi a pranzo (sto qua da 5 anni e la roba peggiore che ho visto è il tofu puzzolente, che puzza di merda di cane). Il punto è che un governatore di una regione non può uscire con frasi razziste e qualunquiste, prima di tutto. E di sicuro non può farlo contro uno dei partner commerciali e strategici più importanti. Io conosco qua imprenditori veneti e non che si sono messi a strapparsi i capelli con l uscita di Zaia. Le esportazioni dall Italia alla cina stavano crescendo tantissimo negli ultimi anni. Il veneto piazza un sacco di vino nel mercato cinese. Con ste battute del cazzo rischi di rompere accordi commerciali ecc, perché i cinesi ti dicono che il vino buono lo fanno anche i francesi e non ci serve il prosecco.
Comunque il giorno dopo ha mandato subito una lettera di scuse all ambasciatore cinese, e adesso lo incontrerà a Roma. Si vede che qualcuno gli ha fatto notare che cazzata assurda ha fatto",it,it,10474993252439046566,13001943395368794277,1
1.0,twitter,@USER Un caffè ☕️!!!! Solo un caffè ?,"Ma #Montero per caso ha fatto una fermata a casa Bargiggia ??
Altrimenti non mi spiego tutto questo livore nei confronti della #Juve",it,it,4827129665735165285,14468596749483626397,1
1.0,twitter,@USER Che cosa?,giuro alla prossima persona che mi mette solo like alle storie e non mi scrive non so che gli faccio,it,it,10495173598604662312,14400106186120702206,0
1.0,reddit,"Qui lo stream per rivederlo.  
Ed il caro marco di fonzo ha già ripubblicato la tabella riepilogativa, col dettaglio regionale ed il numero dei tamponi fatti, sempre dalla protezione civile.",Protezione civile: 2036 totali di cui 149 guariti e 52 morti.,it,it,6070228067677169460,14301244560380839076,0
1.0,reddit,Se l'inglese non è un problema puoi leggere qui,"Domanda allegra che vi consiglio di non leggere se siete ansiosi/depressi/altamente influenzabili. Nel dubbio evitate, tanto sa rispondere solo chi è già medico o studia medicina.
. 
.  
Che cosa succede esattamente quando si muore di polmonite? Ho chiesto a google in tre lingue ma niente di soddisfacente, solo i sintomi. Io vorrei sapere che sensazione si ha? E non parlo di una situazione in ospedale dove ti danno morfina o altro, ma parlo in astratto, di cosa si sentirebbe senza cure mediche di nessun tipo. Finisce l'aria? È un po' come affogare? Oppure è piu come soffocare? O magari si perde conscienza prima di arrivare cosi avanti? Oppure ancora puo succedere in piu modi? E quanto puo durare?
Non voglio saperlo per nessun pensiero strano, solo per curiosità, e lperché per come sono fatta mi fa molta piu ansia non sapere questo genere di cose che saperlo, stesso motivo per cui ad esempio mi interessano cose come Body Worlds, nonostante non abbia alcuna intenzione di diventare medico",it,it,8999359725834056007,251224343591645727,0
1.0,reddit,"Ha provato a telefonare al suo medico di famiglia? Potrei dirti tante cose, ma lui è la persona che capisce meglio la situazione di tua madre. Auguri!","(preciso di NON essere in zona rossa/gialla) Ragazzi, se una persona manifesta sintomi influenzali per alcuni giorni, c'è la possibilità che, nel caso sia Covid, deteriori? Oppure le complicazioni iniziano a spuntare coi primi sintomi? Mia madre (47 anni) ha dei sintomi influenzali da giovedì, non è ancora guarita, ma non ha nemmeno riscontrato complicazioni fuori dalla norma o preso medicine. È la persona per la quale questo Covid mi preoccupa di più, dal momento che ha un sistema immunitario molto debole per una serie di motivi (e si ammala spesso di conseguenza) e soffre di asma. Ribadendo, le condizioni nelle quali si trova adesso non sono affatto preoccupanti, ma ho solo un po' di timore possa peggiorare e rivelarsi Covid a sorpresa dal momento che si dice tanto che dovrebbe già star circolando da un po'. Lei non esce spesso se non per far la spesa, quindi non mi spiegherei da dove l'abbia contratta, in realtà; io, mio fratello e mio padre (che viviamo tutti assieme) non abbiamo avuto alcun malanno nelle ultime settimane. Non capisco se dovessi ragionevolmente preoccuparmi.",it,it,3483300969041908110,10713901772445972719,0
1.0,reddit,"Abito in un condominio, non in un palazzo privato... Magari dovrei contattare l'amministratore per sapere se sa qualcosa al riguardo?","ciao,
a quanto pare forse il tuo palazzo non e stato cablato per motivi condominiali,se non sei in un condominio allora sara Open Fiber a comunicarti a breve che ci saranno dei lavori.
i database non si aggiornano sempre a tempo reale
aspetta e spera come e successo a me,dopo 4 anni hanno comunicato i lavori dentro al mio palazzo.",it,it,7456322162204517892,8266050394387674887,0
1.0,reddit,"> paghiamo i greci per tenerseli a tempo indefinito
Magari i paesi come la Grecia indebitati fino al collo in piena crisi economica accettano pure...
.. un momento un momento un momento ...","oh no, la nostra stratega di pagare i turchi per tenersi i migranti a tempo indefinito non ha funzionato, chi avrebbe mai potuto prevederlo.
c'è una sola soluzione, chiaramente.
paghiamo i greci per tenerseli a tempo indefinito, o chiunque altro in zona abbia voglia di farlo. 
sicuramente questa volta funzionerà.",it,it,3714509432025276999,255308143867597137,1
2.0,twitter,"@USER  @USER Ciao Raffaele, tu l’hai già visto ?",@USER Coro moooolto bravo come sempre …,it,it,17891285614495192719,2496260946572734289,0
2.0,twitter,@USER ?❄️❄️❄️???,@USER La vista è molto bella e ha bisogno di 10 coperte,it,it,3233201973567825064,14227989082657683662,0
1.0,reddit,"Come mai non provi a vedere i tuoi colleghi anche fuori dal lavoro se ti ci trovi bene?
Per i consigli contro la solitudine, posso darti quelli che ho messo in atto io nel periodo della mia vita in cui mi sono trovata totalmente senza amici: leggevo tantissimo, guardavo tantissimi film, ero sempre in anticipo sullo studio.
Però a me piaceva stare sola, quindi non cercavo compagnie nuove, mi stava bene così (probabilmente questo è vero per due motivi: 1) il periodo è durato qualche mese, magari alle lunghe avrei iniziato a cercare nuove persone anche io e 2) in assoluto tendo a essere una persona solitaria e ci sono settimane in cui preferisco stare a casa invece di uscire, da sempre!).
EDIT: Leggo che ti hanno invitato a scrivere se hai voglia di un amico di penna. Contatta anche me, se ti va, senza problemi!! :)","I miei amici si contano sulle dita di una mano e ogni volta che organizziamo qualcosa è molto probabile che qualcuno dia buca e saltino i piani. Ormai il weekend mi mette tristezza, preferisco andare al lavoro dove almeno sto bene in compagnia dei colleghi. So che dovrebbe essere facile fare nuove conoscenze per una ragazza in città, ma non lo è. Consigli contro la solitudine?",it,it,380015626055083516,4484998939048813084,0
1.0,reddit,URL  Sei stato a Baggiovara?,"Io a Modena da Giovedì ho sintomi influenzali leggeri ma senza febbre, ora già in via di guarigione. La guardia medica mi ha detto che non ero soggetto a rischio, dato che ero negativo a tutte le domande, quindi niente tampone. Però boh!",it,it,1250458896487801250,13712689831165639182,0
1.0,reddit,"Il punto 1 per me non era valido al liceo, sbagliavi un segno e salutavi il resto dell'esercizio con la manina.","Uni per 2 motivi
1) Anche studiando puoi fallire miseramente: una svista su un calcolo, un segno, ... e metà esame è andato. Al liceo spesso ci si appiglia al ""il procedimento è corretto, è un misero errore di calcolo"", mentre in Uni è sbagliato, fine.
2) Ogni singola cosa detta o accennata a lezione è materia d'esame. Mentre al liceo basta sapere gli argomenti in genere",it,it,16393236540020087364,10017216717459728733,0
