level,source,reply,post,language,language_variety,reply_id,post_id,majority_vote
1.0,twitter,@USER ... O esaltandolo..,"Il silenzio e come un fiume di sabbia                                                                 che lentamente copre tutto quello che c’era di bello                                occultandolo alla vista dell’anima....
RelaxBeach©",it,it,9496337119089889126,7357414994945043930,0
1.0,reddit,"Calma, queste sono direttive date proprio dallo store manager e dalla proprietà. Il commesso non gode affatto se non ve lo cambia, anzi, sai quanto gliene frega? Che poi, come è capitato a me e ai miei ex colleghi centinaia di volte, se il responsabile cambia il prodotto al cliente inviperito è soltanto per evitare di litigarci perché ripeto, sono loro stessi a dirci cosa dobbiamo fare in taluni situazioni.
E la conseguenza qual è? Che il responsabile se ne fotte se c'è un prodotto invendibile e il venditore si deve prendere la briga di tentare di rendere/sistemare/rivendere un prodotto cambiato molte volte a cazzo e per un capriccio da maleducati di un cliente. Quando c'è l'inventario annuale bisogna poi giustificare perché tot stock di merce è rimasto invenduto, vallo a spiegare ai piani alti...","Se il commesso continuerà a fare muro, egli sarà preso e portato immediatamente dal responsabile",it,it,15597092344066966299,6535513880047527192,0
2.0,twitter,@USER  @USER Anche per rompere il ghiaccio,@USER Gianca già che ci sei regalale un paio di mutande vah che fuxia e giaguaré 'nzomma... ?,it,it,15902869978243358740,7961696982295378594,1
1.0,reddit,">PS se hai la pelle sensibile evita il rasoio elettrico
E invece è questo il mio consiglio ahaha","Io uso sia il rasoio di sicurezza che lo shavette (che ti sconsiglio almeno inizialmente perché devi prenderci la mano) ma ho la barba folta,le parti che rado sono minime.
Col rasoio di sicurezza a parte il discorso economico (100 lamette astra verdi ti costano meno di 10 euro e con una lama riesci a fare anche 2/3 rasature) la rasatura viene meglio poiché il rasoio taglia meglio con meno passate di lama. (Leggi letteralmente due passate normale e contropelo)
Come rasoio di sicurezza ti suggerisco il Parker 98R è piccolo e fa bene il suo lavoro
Usare la crema per barba a pennello o,in alternativa il gel da barba (lo fa la nivea) e dare il tempo di aderire (se hai fretta sapone e pennello è da escludere)
Il mio suggerimento è di usare sul collo la pasta fissan per il sedere dei bambini (quella blu) e per il resto del viso qualsiasi altro prodotto.
Per altre domande chiedi pure
PS se hai la pelle sensibile evita il rasoio elettrico",it,it,13889809461410309670,9739175578440028850,0
1.0,reddit,Lo dissi tempo fa in un thread analogo: gli HR andrebbero nuclearizzati tutti dal primo all'ultimo,"Non l'ultimo che ho fatto (l'ultimo che ho fatto, poi mi hanno assunto), ma uno degli ultimi... Azienda web medio/grande milanese, nota a pochi, ma con tanti dev.
HR, si presenta con un mio cv di 5 anni prima (chissà dove l'aveva preso) e dopo le solite domande introduttive: ""Ecco, vorrei sapere se stai facendo altri colloqui"" - ""Sì, certo"" (me l'hanno chiesto in molti, non ho mai nascosto la verità)
Faccia rabbuiata dell'HR: ""Eh, non ti faccio fare il colloquio tecnico, tu devi essere convinto di voler lavorare per noi e cerchiamo gente che voglia solo lavorare con noi!""
Io la guardo e le faccio: ""Non siete mica google"" (la prima cosa che mi passava per la testa)
Mi ha accompagnato alla porta. Credo di aver schivato un bel proiettile.",it,it,4110758050476660806,12650296792333791569,0
1.0,reddit,"Piu' che AMA, al massimo una story time.
&#x200B;
>!in b4: ""ma no niente..."" ""classica cosa.."" ""bah solite cazzate da innamorati/giovani...""!<",Ho idealizzato una ragazza avuta in passato (tanto passato) e ora non mi piace più nessun altra. AMA?,it,it,9397822508595343638,225288318251128266,0
2.0,twitter,@USER Nonnino! Già sveglio? ??,@USER Non troppo buongiorno,it,it,4652172244294165548,4824587311292975614,1
1.0,twitter,@USER il terrone di essere rimpiazzata,il terrore di essere rimpiazzata,it,it,18161905213580884688,7155693771356046855,1
1.0,twitter,@USER Tanto per non essere banali,"Elly #Schlein: ""Il lavoro deve tornare a essere un tema centrale. Per la destra il lavoro è un favore, per noi è un diritto""

@ultimora_pol",it,it,5855671312721211658,5929177359346716605,1
1.0,reddit,"Se le toghe rosse avessere mandato un avviso di garanzia al virus, ora saremmo in una botte di ferro,","Se solo la società perseguisse l'obiettivo di contenimento con la stessta stregua con cui ha inseguito Berlusconi e le sue mignotte saremmo salvi. /s
Scusate dimenticato /s",it,it,10284801989587274790,12099038560420169473,1
1.0,reddit,"Non ci darei troppo la colpa in questi casi. I media domenica scorsa erano davvero da terrorismo mediatico, e ci sta che la gente che si trova circondata da informazioni del genere vada in panico. Sarebbe successo in qualunque altra nazione.","Tra le cose che questo virus sta dimostrando di noi Italiani, è che siamo davvero un popolo di pecoroni.
Domemica 23/2 alle 13 avevamo 137 contagiati nazionali e - dopo 'sole' 36h di bombardamento mediatico - ci accingevamo ad assalire i supermercati del nord Italia.
Da domenica sera il numero di contagiati è sostanzialmente raddoppiato ogni 2 giorni per giungere ai quasi 1200 di ieri sera e - dopo 4 giorni di downplay mediatico - passiamo dallo scannarci per l'ultima confezione di penne (non liscie!) sullo scaffale, a scannarci per il rinvio di Juve-Inter.
Siamo davvero materiale per comici.",it,it,17672896905194932412,10002731475965481359,0
1.0,reddit,"Anch'io di porno vero e proprio penso di averne pochi e ben selezionati. Invece ho molto nudo ""soft"", senza atto sessuale.
Non che non mi piaccia vedere del sesso o abbia gusti particolarmente artistici, è solo che molti porno poi mi annoiano o mi sembrano troppo finti, e quindi li cancello.
Un bel set di nudo fatto bene mi stimola di più la fantasia.","Un quarto TB in 7 anni???? Sei stato molto ""choosy""",it,it,4390789009512965531,2572014533198106852,0
1.0,reddit,">Non sono cose che si fanno a tavolino
Insomma. Non nei minimi dettagli, ma puoi preparare la ""coltura""","Mi sembra una trovata geniale come quella dei politici di turno che ""vogliono creare una Silicon Valley italiana""—o europea per quel che ce ne frega.  Non sono cose che si fanno a tavolino: sono cose che accadono quando ci sono le condizioni giuste tutte attorno.
Fare un sistema operativo è fattibile, cosa che non è organizzabile a tavolino è la sua adozione che dipende dalla presenza di un ecosistema di applicazioni di qualità buona da poter lottare contro Office di Microsoft, etc.
Dovremmo puntare su mercati dove non c'è un polo mondiale esistente e prenderne la fuida, e.g., potremmo puntare sul diventare il polo mondiale per le energie rinnovabili stando sempre un passo avanti e vendendo le nostre tecnologie a tutti gli altri invece di subirle e dover inseguire.",it,it,6507324498602374866,1969467445357620244,0
1.0,reddit,"Stai tranquillo, non succederà nulla di grave! :)
Posso chiederti un favore? Puoi fare stare tranquilli anche noi e chiamare il tuo medico curante, il 112 o il numero di emergenza della tua regione e far sì che questa sia l'ultima volta che chiedi diagnosi su Reddit? Scusa se sembro rompicoglioni ma per me è una pratica davvero pericolosa e senza senso.","La mia tosse continua ad esserci anche se meno frequente, calmata probabilmente dal bisolvon che ho preso per 3 giorni e l'abbuffata di halls Che sto facendo.
Quello che è aumentato è il fastidio/doloriccio al petto, lato sx, che è fisso, proprio all'altezza del cuore. Ed ho una sensazione strana di ""apnea leggera"" con nodo in gola. 
Molto simile ai sintomi che avevo quando ero in preda all'ansia o attacco di panico.
Posso star tranquillo, no?",it,it,13065943374569083786,12358788926884935924,0
2.0,twitter,@USER  @USER Prego ?,@USER  @USER Mi offro volontario.,it,it,12125108903196202267,13137898576150207177,0
1.0,twitter,Quindi con oriana x lui capitolo chiuso #gintonic,Ginevra supporta ancora Antonino #gintonic,it,it,4036842007723345961,16033051269232167402,0
2.0,twitter,"@USER  @USER Secondo me non è tanto una questione di merito, ma di metodo.
Se si insiste ancora in una contrapposizione di posizionamento e corrente e non di voglia dialettica di confronto e sintesi, si ritorna sempre allo stesso vulnus. A zero 

Omicron di Gregoretti.","@USER  @USER Io vedo una regressione involutiva rispetto al progetto di Veltroni. Chi ha remato sempre contro viene allo scoperto, tristemente coadiuvato da alcune nuove leve e da quanti vigliaccamente prendono le distanze dalle migliori esperienze riformiste",it,it,775450123668054468,3242039672985715201,0
1.0,reddit,Presumo sia l'88enne con quadro clinico compromesso di qualche giorno fa.,Primo morto a San Marino,it,it,1010234326900614850,16577578940332240441,0
1.0,reddit,"Ci sta, purtroppo non sono mai stato in questi negozi e non so fare un confronto pratico però bisogna riflettere (secondo me) anche in ottica durabilità. Per esempio ho un pantalone dickies da 2 anni che è ancora nuovo (faccio skateboard e chissà quante volte ci sarò caduto). Quindi comprare una giacca dickies usata (o di un altro qualsiasi brand) non è una scelta stupidissima","I negozi dell'usato che frequento io per quanto riguarda i vestiti si dividono in due tipologie:  

Quelli low cost che al 90% vendono vestiti anni '70 che sanno da naftalina  
Quelli belli che vendono felpe anni '90 a prezzi folli perchè ""non è usato, È VINTAGE""  

Quindi capirai bene il perchè preferisco il nuovo.",it,it,11869357271065260984,2383386898612669131,0
1.0,reddit,"> Ieri ho provato a installare Apache OpenOffic
A parte che non è più in sviluppo e non più aggiornato, tanto che dicono gli stessi sviluppatori di non usarlo e usare libreoffice","Eccomi! Nuovo problema con Windows 10.
Ieri ho provato a installare Apache OpenOffice. Dopo averlo scaricato, Windows non me lo lascia installare dicendomi che non è un programma riconosciuto (o ufficiale) di Windows quindi possibilmente dannoso per il computer.
Come risolvo?",it,it,4958025179977378870,6564631771218135278,0
1.0,reddit,"Fa punteggio se accetti, più facile che ti richiamino in futuro anche in altre scuola più vicine.","ho ricevuto una convocazione per supplenza ATA 3° fascia (collaboratore scolastico quindi credo bidello) per un mese, convocazione arrivata oggi e inviata a 500 persone (io sono dopo il n. 400). 
la città dove si svolgerebbe l'impiego è a 5h di pullman quindi dovrei trasferirmi per un mese, il che è fattibile (ho trovato diverse stanze in affitto/subaffitto a 350/400euro). 
Il problema è che lo ""scrutinio"" e l'inizio del lavoro sono domani! praticamente dovrei fare la valigia e partire in nottata.
Mi domando se possa valere la pena sbattersi così tanto solo per un mese, io al momento sto svolgendo l'ultimo mese di uno ""stage"" e prendo 780€ per 24h/settimana (questo lavoro non fa per me quindi non continuerò dopo marzo), il titolare è un mio parente e dovevo già finire a febbraio ma sono rimasto solo per aiutare un po' su sua richiesta, mi ha detto che in caso non c'è problema e di andare.
&#x200B;
chi mi dice la sua? pensavo che magari poteva essere utile per fare punteggio però non sono molto oggettivo perchè nella città in questione c'è una mia vecchia fiamma e la cosa credo mi stia sviando troppo...
se va bene, sto qualche giorno da lei e poi prendo una stanza a caso per un mese, se va male resto qualche giorno a fare vacanza insieme a lei.
&#x200B;
chi mi da la sua opinione da esterno?? ne ho estremo bisogno
Edit: sono in bus, ho deciso di andare, vi aggiorno sul thread di domani",it,it,8878726692087388459,15842385271803291867,0
1.0,twitter,"@USER Contrasto nei suoi sogni. 
Non si possono arrestare i flussi migratori, possono cambiare le rotte, ma non ci si fermerà mai.
Meglio sarebbe a questo punto cooperare per realizzare finalmente  corridoi umanitari.
Ma qualcuno gode dell'emergenza, dei problemi spesso amplificati.","Giorgia #Meloni: ""Ci vuole più Europa sul fronte sud, da soli non possiamo gestire un flusso con dimensioni ormai ingestibili. Occorre che l'Europa realizzi con urgenza un quadro di cooperazione multilaterale, con un incisivo contrasto ai flussi illegali""

@ultimora_pol",it,it,5130324169160241384,5868922214414389639,0
2.0,twitter,@USER Grazie. Sono fuori condizione e mi sono allenato poco. . Oggi l ho fatta divertendomi ed è stata bella così ?,@USER sotto l'ora .... bravo,it,it,15232134803666437702,7798680555973434365,0
2.0,twitter,@USER Possibile io sono sempre fiducioso però,@USER Da quando Barbara Durso fa vedere le truffe sentimentali penso che tante persone non si fidano più..,it,it,17160569677474900305,16499798395393286948,0
1.0,reddit,"Ho giocato alla 3.5 quando ancora si poteva giocare completamente senza pagare. Supportavo un amico che ha vinto e siamo pure andati al raduno dell'alleanza, probabilmente una delle robe più nerd mai fatte. Nostalgia per certi versi ma toglie la vita, non ci si può giocare seriamente",È appena finito un server di Travian (qualcuno ci gioca o ci ha mai giocato?) su cui giocavo da più di un mese. Sono finito nella top 300 e la nostra Mera non ha vinto però è stato un bel server. Feels,it,it,3728691363709466994,4839224598177119245,0
1.0,reddit,Già ti accende la macchina e può sentire se il motore suona bene.,"Dunque il consiglio gettonato di portarsi il meccanico non so che senso abbia, anzi se qualcuno mi dice cosa può fare un meccanico con una semplice occhiata sarei grato.
Quello che mi sento di consigliare è

cercare le vendite dei privati, tanto il rivenditore quasi mai ti da una garanzia reale e si limitano a pulire gli interni per renderla presentabile.
non farti spaventare da macchie sui sedili e difetti estetici minori anzi usali per tirare il prezzo con la consapevolezza che con un po' di detailing la fai tornare nuova (stesso trucco che usano i commercianti)
controllare la documentazione (tagliandi, bolli, manutenzioni straodinarie), capisci quali sono le prossime ""grosse "" manutenzioni, per esempio: revisione bombola gpl, dischi freni, cinghia o catena distribuzione..
fai un giro di prova per sentire come va e verificare l'allineamento delle lamiere eventuali asimmetrie, aria tra i vari pannelli (anche se ultimamente escono già di fabbrica con tolleranze disgustose) per farti un idea se è stata incidentata. Alcuni usano uno lo spessimetro per misurare lo strato di vernice per capire se è stata riveniciata.. Considera che quelli economici non sono così affidabili.
sottrai dal tuo budget massimo una cifra congrua per eventuali sorprese (su una utilitaria 500€ dovrebbero bastare per affrontare più o meno tutto tranne una rottura motore)...",it,it,15991848650180007832,6878336134883742551,1
1.0,reddit,"Ti dirò, visto che è difficile tradurre il sarcasmo con il testo e che sul sub ci sia tanta gente che fraintende in fretta è difficile fare altrimenti",Odio l'uso smodato dei /s su r/italy,it,it,13579969423163834716,9720699699895390632,0
2.0,twitter,@USER Veramente ce pensa quell'altro. Io sono un mero elemento di disturbo.,"@USER No no è giusto, ce deve sta, la nutri la coccoli la tieni calda, ce deve sta",it,it,3263697220254276145,18184193230015004878,1
1.0,twitter,@USER Sempre pensato che sarebbe stato tanta roba da mezz’ala come alternativa a barella ma anche insieme come seconda mezz’ala,De Paul nel 352 diventa una bestia. Una bestia.,it,it,1937614627376850774,16827608901807325391,0
1.0,reddit,"Guarda lo speciale sul Vietnam, un'opera d'arte.
Hamster è troppo simpatico e James May è un lord di altri tempi. Clarkson invece non lo sopporto, mi ha sempre dato la sensazione di essere un bullo ignorante (non per niente lo licenziarono per aver preso a pugni un membro dello staff). Ha la sua funzione nel trio, ma ci son delle volte che i cazzotti vorrei darglieli io.","Di sicuro sono l'ultimo a scoprirlo ma Top Gear (quello ""originale"") è dannatamente spassoso, anche per chi, come me, di automobili se ne frega. E pensare che l'ho recuperato solo dopo aver visto The Grand Tour su Prime... Quei tre mi fanno tagliare!",it,it,8653197461358205752,9760638930996866032,0
1.0,reddit,">Al liceo spesso ci si appiglia al ""il procedimento è corretto, è un misero errore di calcolo"", mentre in Uni è sbagliato, fine
Questo spiega tantissime cose a chi pensa che per fare bene all'università in materie scientifiche basta essere stati bravi al liceo","Uni per 2 motivi
1) Anche studiando puoi fallire miseramente: una svista su un calcolo, un segno, ... e metà esame è andato. Al liceo spesso ci si appiglia al ""il procedimento è corretto, è un misero errore di calcolo"", mentre in Uni è sbagliato, fine.
2) Ogni singola cosa detta o accennata a lezione è materia d'esame. Mentre al liceo basta sapere gli argomenti in genere",it,it,6305482604337919673,10017216717459728733,0
1.0,reddit,"Per te che sei sveglio forse. Ma guarda che c'è uno sterminio di persone che prende a scatola chiusa km0, come anche bio, senza farsi la più minima domanda.
Se ne parlava anche qui mi ricordo, e non è tanto diverso dalle fandonie sull'olio di palma.","TL;DR se mangi carne fai sempre danni all'ambiente, anche se mangi locale
Titolo un po' clickbait insomma",it,it,12698729356330528698,14212937419637664393,0
2.0,twitter,@USER ???????????????????????????,@USER Oddio potevo essere io. Mi da fastidio la crosta tutta unta intorno. Preferisco che si stemperi col riso mischiato.,it,it,16131481320597212140,6169037621248420861,0
2.0,twitter,"@USER &gt;l’altro questo medico suggerisce al paziente di trovare un altro collega di riferimento, appunto per non inficiare il suo percorso. A meno dal medico che non siano state fatte osservazioni di altro tipo, urge ricordare che si tratta pur sempre di farmaci.","@USER La tematica è sensibile, ma non credo si tratti di discriminazione tout court. Un medico agisce (dovrebbe, almeno) in scienza e coscienza, non copia prescrizioni altrui se non ne condivide la bontà, “dissidi” tra MMG e specialisti sono capitati anche a me, e per tutt’altro. Tra&gt;",it,it,3867336572010331778,3860466237279541675,0
1.0,twitter,@USER  @USER Auguri littlegrif ❤️?,"Oggi è il compleanno della Teppa delle Teppe, capo indiscusso di tifo, mamma dolcissima e orgogliosa. dispensatrice di ansie, maestra di santificazioni e Amica con la A maiuscola.
Auguri  @USER ❤️?",it,it,17571843573175046866,6671005819286462276,0
1.0,reddit,Rincara la dose dicendole che morirete tutti,"Gli effetti del Covid-19 sulla popolazione : ho un principio di influenza, con temperatura a 37.4. 
Appena mia madre l'ha saputo è quasi andata fuori di testa, è nel panico, sii sta misurando la temperatura anche lei e vuole avvisare le autorità.
Salvatemi.",it,it,3210681809367953482,4625931298966675422,1
2.0,twitter,@USER ?❄️?,@USER ??☀️    ?❣,it,it,11247528056599234420,457436274759233740,1
1.0,reddit,"Io per ora a circa 5 minuti a piedi, spesso torno anche a casa a pranzo. Purtroppo vivo proprio in culo alla luna. :|","Questo week eravamo al tavolo con amici e per alzata di mano ho chiesto quanto tempo ognuno impiega ogni giorno per andare a lavoro, sono sorpreso su 11 persone la media sta poco sotto un ora...le persone semplici che lavorano di fianco a casa non ci sono piu? 
Voi popolo del caffè quanto ci mettete ?",it,it,18052259685747730410,16024223345384176086,0
2.0,twitter,@USER  @USER  @USER  @USER  @USER Non se n'è mai andato: è un componente del PDitta da sempre.,@USER  @USER Io mi sono perso nella  cronologia di  @USER ... adesso è nuovamente nel  @USER ?,it,it,13599020026271593789,12841824500967152638,1
1.0,reddit,"/u/timendum
/u/lord_thejc  
Visto che avevate le mani in pasta nei precedenti Megathread.
Con questa nuova formula il thread si riempie di domande cicliche.
Le faq in sticky aiuterebbero molto","Per i mod. Non sarebbe meglio avere le FAQ in evidenza anche dentro il megathread? Come facevate prima di avere il live. Secondo me aiuterebbe parecchio.
Edit: magari si potrebbe fare un thread a se solo con le FAQ e metterlo in evidenza. Ma magari diventa troppo",it,it,17555455602524822419,3624251656623757984,0
1.0,reddit,"Si, dovrebbero chiedersi in primis perche i SO windows siano i più diffusi",Il problema come sempre non è sviluppare le cose ma farle usare alla gente.,it,it,7673724281565677533,12821042278998949964,0
1.0,reddit,"Considera che ieri sera avevo una linea di febbre, ho informato, mi é stato detto di non fare allarmismo e venire a lavorare. Quindi qui proprio é la mentalità alla base il problema.","Ieri tornando a casa sentivo un avvocato in radio che tutto soddisfatto annunciava che il garante della privacy ha dato ragione a lui dichiarando che un datore di lavoro non può permettersi di chiedere a un lavoratore di provare la febbre, e manco può chiedere se ha altri sintomi.
Mi sta bene se il garante della privacy dichiara che io non sono tenuto a dare una lista di posti che ho visitato nel weekend, o con chi ho avuto rapporti, o se la mia fidanzata è di Wuhan. Però mi chiedo, nell'interesse collettivo che male farebbe una veloce prova della febbre?
Ho passato la mia vita lavorativa a evitare gente con raffreddore e febbre che veniva comunque al lavoro perché il datore era un pezzo di merda che poi te la ""faceva pagare"", oppure per semplice leccaculismo (ha visto, Dottore? Io ho 39 di febbre e sono qui a farmi il culo, questi per un raffreddore scappano!).
Cosa ne pensate? Se fosse per me in questo periodo metterei prove della febbre obbligatoria all'entrata dell'azienda. C'è ancora un sacco di gente che ha lievi sintomi e sta facendo finta di niente e continua la propria vita senza farsi domande.
Se ho torto mi spiegate perché?",it,it,17931595392849049925,16452922428110613647,0
1.0,reddit,"Nessuno sa quello che succederà, e a quanto pare il peggio deve ancora arrivare. Quindi lascerei in attesa i programmi per il futuro per ora.","Non sono persona che si fa prendere dalla paranoia, tuttavia ho una domanda:
Sono in una LDR con una ragazza Slovacca, ci vediamo ogni 2 settimane nel weekend, mi ha convinto a cancellare i biglietti dell' autobus per andarla a trovare il 7/8 Marzo.
Io ed un mio amico dovremmo andare sù il 20/21/22 Marzo in auto, tuttavia la sua famiglia è abbastanza preoccupata essendoci la moglie del fratello della mia ragazza incinta.
Vorrei capire intanto se le loro paure siano fondate o meno e vorrei un consiglio per capire se procedere con la prenotazione dell' hotel o meno.",it,it,6732918072364047717,3409304517615862287,0
1.0,reddit,"È presto, stiamo vedendo i contagi di 15 giorni fa, questo virus è stronzo: ha incubazione lunghissima.
Ma poi le misure implementate sono blandissime.","ma il contenimento sta funzionando se ogni giorno finiamo per scoprire più contagiati del precedente? (più o meno).
Non dovremmo assistere ad una diminuzione dei nuovi casi o è ancora presto per vedere gli effetti positivi del lockdown?",it,it,3599891914149261814,5759632215517067542,0
1.0,twitter,"@USER Come è stato in passato,doveva essere radiata invece fu portata in serie B. Il caso Suarez insegna.",Per Tuttosport alla fine di questa storia alla Juve daranno un premio,it,it,11550750205266638181,16916958787109619034,0
1.0,twitter,@USER Tempo perso in cose inutili. E io pago....!,"#Camera
Respinto in commissione un emendamento di AVS per modificare il nome del ""Ministro del Made in Italy"" in ""Ministero del fare italiano""

@ultimora_pol",it,it,9960698491608353483,8374295896122236596,1
1.0,reddit,immagino che dipenda dal settore lavorativo,A scopo lavorativo è più utile imparare il francese o il tedesco?,it,it,17625438422202104201,15549326271531958549,0
1.0,reddit,"Il liceo è sicuramente più opprimente, non lascia alcuna libertà d’azione. Per cinque anni mi sono davvero sentito in gabbia... e oltre ai suoi vari problemi, 5 anni sono decisamente troppi.
L’università è stata senz’altro un gran passo avanti, anche solo per la varietà di persone ed esperienze che ti pone davanti","Liceo. Mi ha letteralmente consumato per cinque anni, ogni santissimo giorno le stesse persone per 5 ore al giorno, sempre le stesse materie, ogni pomeriggio uguale agli altri... Probabilmente l'ho gestito male ma in università sono molto più sereno, studio perché mi piace, mettermi sui libri anche per 10 ore non mi pesa perché la mia preparazione non viene verificata ogni santissimo giorno.",it,it,4145184937501722747,3762798346428327885,0
2.0,twitter,@USER ❄️❄️?,@USER ❄️❄️?,it,it,7556346922631911401,8893923441380475473,0
2.0,twitter,"@USER  @USER  @USER  @USER  @USER  @USER  @USER  @USER Felice domenica Silvia,spensierata e serena per tutti ?","@USER  @USER  @USER  @USER  @USER  @USER  @USER  @USER Buongiorno Lucia ☕??
Buona domenica ?? a te e tutti ?????",it,it,6741704352939593266,8452877323647926974,0
2.0,twitter,"@USER  @USER Effettivamente. Cerca nell'armadio se trovi una striscia lì, persa dopo essersi scucita ?","@USER ?non dovrebbe avere tre strisce? 
#chiedoperunamico",it,it,10568660044232783997,1439242534760018183,1
1.0,reddit,"I posti mezzi vuoti e desolati, sopratutto quelli grandi hanno un certo fascino IMO, tipo i centri commerciali","milano vuota comincia ad avere il suo fascino, anche se il fatto che sia tale mi fa preoccupare per eventuali aggressori/malintenzionati di sorta. basterà starnutire loro addosso? 
isola ieri nel pomeriggio era desolata.",it,it,9999778361843356480,9487594633900858164,0
